400C100US41833,41833,"Ishpeming, MI Urban Cluster (2010)",12678,313
400C100US41914,41914,"Ithaca, NY Urbanized Area (2010)",53934,689
400C100US41941,41941,"Itta Bena, MS Urban Cluster (2010)",3799,410
400C100US41995,41995,"Jacksboro, TX Urban Cluster (2010)",4239,129
400C100US42022,42022,"Jackson, AL Urban Cluster (2010)",3236,305
400C100US42049,42049,"Jackson, CA Urban Cluster (2010)",7138,419
400C100US42076,42076,"Jackson, GA Urban Cluster (2010)",5194,280
400C100US42103,42103,"Jackson, KY Urban Cluster (2010)",2559,354
400C100US42157,42157,"Jackson, MI Urbanized Area (2010)",89433,1189
400C100US42184,42184,"Jackson, MN Urban Cluster (2010)",3188,66
400C100US42211,42211,"Jackson, MS Urbanized Area (2010)",350916,2004
400C100US42265,42265,"Jackson, TN Urbanized Area (2010)",70945,701
400C100US42319,42319,"Jackson, WY Urban Cluster (2010)",11415,448
400C100US42346,42346,"Jacksonville, FL Urbanized Area (2010)",1069990,2780
400C100US42373,42373,"Jacksonville, IL Urban Cluster (2010)",22090,174
400C100US42400,42400,"Jacksonville, NC Urbanized Area (2010)",104885,1490
400C100US42427,42427,"Jacksonville, TX Urban Cluster (2010)",13808,394
400C100US42439,42439,"Jackson--Wellston, OH Urban Cluster (2010)",11762,277
400C100US42454,42454,"Jaffrey, NH Urban Cluster (2010)",2410,455
400C100US42481,42481,"Jamestown, NY Urban Cluster (2010)",43142,616
400C100US42508,42508,"Jamestown, ND Urban Cluster (2010)",15105,278
400C100US42535,42535,"Jamestown, OH Urban Cluster (2010)",3932,326
400C100US42562,42562,"Janesville, WI Urbanized Area (2010)",69422,373
400C100US42616,42616,"Jasper, AL Urban Cluster (2010)",13797,346
400C100US42643,42643,"Jasper, FL Urban Cluster (2010)",5206,365
400C100US42670,42670,"Jasper, GA Urban Cluster (2010)",6311,546
400C100US42697,42697,"Jasper, IN Urban Cluster (2010)",15568,475
400C100US42724,42724,"Jasper, TN Urban Cluster (2010)",3088,443
400C100US42751,42751,"Jasper, TX Urban Cluster (2010)",7755,363
400C100US42805,42805,"Jeanerette, LA Urban Cluster (2010)",6248,379
400C100US42832,42832,"Jean Lafitte, LA Urban Cluster (2010)",2477,393
400C100US42849,42849,"Jefferson, GA Urban Cluster (2010)",10419,633
400C100US42859,42859,"Jefferson, IA Urban Cluster (2010)",3819,161
400C100US42870,42870,"Jefferson, NC Urban Cluster (2010)",3871,459
400C100US42913,42913,"Jefferson, OH Urban Cluster (2010)",2988,370
400C100US42967,42967,"Jefferson City, MO Urbanized Area (2010)",58925,905
400C100US42978,42978,"Jefferson Township North, NJ Urban Cluster (2010)",14041,649
400C100US42994,42994,"Jena, LA Urban Cluster (2010)",3903,278
400C100US43021,43021,"Jennings, LA Urban Cluster (2010)",10286,248
400C100US43048,43048,"Jerome, ID Urban Cluster (2010)",11350,433
400C100US43064,43064,"Jersey Shore, PA Urban Cluster (2010)",10448,504
400C100US43075,43075,"Jerseyville, IL Urban Cluster (2010)",9254,367
400C100US43102,43102,"Jesup, GA Urban Cluster (2010)",10871,678
400C100US43115,43115,"Jewett City, CT Urban Cluster (2010)",10209,713
400C100US43129,43129,"Jim Thorpe, PA Urban Cluster (2010)",5844,426
400C100US43210,43210,"Johnson City, TN Urbanized Area (2010)",122634,1386
400C100US43217,43217,"Johnson Creek, WI Urban Cluster (2010)",2688,64
400C100US43227,43227,"Johnson Lane, NV Urban Cluster (2010)",5395,463
400C100US43237,43237,"Johnston City, IL Urban Cluster (2010)",3552,87
400C100US43253,43253,"Johnstown, CO Urban Cluster (2010)",13777,409
400C100US43264,43264,"Johnstown, OH Urban Cluster (2010)",5058,377
400C100US43291,43291,"Johnstown, PA Urbanized Area (2010)",68712,635
400C100US43345,43345,"Jonesboro, AR Urbanized Area (2010)",65988,767
400C100US43372,43372,"Jonesboro, LA Urban Cluster (2010)",5535,316
400C100US43383,43383,"Jones Creek, TX Urban Cluster (2010)",3148,359
400C100US43399,43399,"Joplin, MO Urbanized Area (2010)",81528,1040
400C100US43426,43426,"Jordan, MN Urban Cluster (2010)",5266,177
400C100US43480,43480,"Junction, TX Urban Cluster (2010)",3054,201
400C100US43507,43507,"Junction City, KS Urban Cluster (2010)",37582,470
400C100US43534,43534,"Junction City, OR Urban Cluster (2010)",6048,225
400C100US43561,43561,"Juneau, AK Urban Cluster (2010)",24742,588
400C100US43571,43571,"Juneau, WI Urban Cluster (2010)",2721,115
400C100US43595,43595,"Jupiter Farms, FL Urban Cluster (2010)",10149,805
400C100US43604,43604,"Justin, TX Urban Cluster (2010)",3054,112
400C100US43615,43615,"Kahului, HI Urbanized Area (2010)",57065,1622
400C100US43642,43642,"Kailua (Hawaii County)--Holualoa, HI Urban Cluster (2010)",32890,2024
400C100US43669,43669,"Kailua (Honolulu County)--Kaneohe, HI Urbanized Area (2010)",113936,2448
400C100US43696,43696,"Kalaheo, HI Urban Cluster (2010)",14909,849
400C100US43711,43711,"Kalama, WA Urban Cluster (2010)",3611,677
400C100US43723,43723,"Kalamazoo, MI Urbanized Area (2010)",211295,1069
400C100US43777,43777,"Kalispell, MT Urban Cluster (2010)",31623,806
400C100US43804,43804,"Kalkaska, MI Urban Cluster (2010)",2713,300
400C100US43818,43818,"Kamas, UT Urban Cluster (2010)",2890,465
400C100US43831,43831,"Kanab, UT Urban Cluster (2010)",3045,357
400C100US43858,43858,"Kane, PA Urban Cluster (2010)",3676,131
400C100US43885,43885,"Kankakee, IL Urbanized Area (2010)",80725,734
400C100US43912,43912,"Kansas City, MO--KS Urbanized Area (2010)",1520291,1634
400C100US43939,43939,"Kapaa, HI Urban Cluster (2010)",18357,950
400C100US43966,43966,"Kapaau, HI Urban Cluster (2010)",4212,762
400C100US43993,43993,"Kaplan, LA Urban Cluster (2010)",4825,165
400C100US44020,44020,"Karnes City, TX Urban Cluster (2010)",3048,66
400C100US44047,44047,"Kasson, MN Urban Cluster (2010)",7064,166
400C100US44074,44074,"Kaufman, TX Urban Cluster (2010)",5988,275
400C100US44128,44128,"Kayenta, AZ Urban Cluster (2010)",4287,622
400C100US44155,44155,"Kearney, MO Urban Cluster (2010)",7333,316
400C100US44182,44182,"Kearney, NE Urban Cluster (2010)",31305,296
400C100US44209,44209,"Keene, NH Urban Cluster (2010)",22675,750
400C100US44236,44236,"Kekaha, HI Urban Cluster (2010)",4753,629
400C100US44263,44263,"Kellogg, ID Urban Cluster (2010)",2936,285
400C100US44290,44290,"Kelseyville, CA Urban Cluster (2010)",3105,700
400C100US44317,44317,"Kemmerer, WY Urban Cluster (2010)",3092,201
400C100US44344,44344,"Kenai, AK Urban Cluster (2010)",4731,345
400C100US44371,44371,"Kendallville, IN Urban Cluster (2010)",10673,460
400C100US44398,44398,"Kenedy, TX Urban Cluster (2010)",5274,338
400C100US44425,44425,"Kennebunk, ME Urban Cluster (2010)",8471,408
400C100US44452,44452,"Kennett, MO Urban Cluster (2010)",11596,222
400C100US44479,44479,"Kennewick--Pasco, WA Urbanized Area (2010)",211515,1314
400C100US44506,44506,"Kenosha, WI--IL Urbanized Area (2010)",124116,581
400C100US44533,44533,"Kenton, OH Urban Cluster (2010)",8335,386
400C100US44560,44560,"Keokuk, IA--IL Urban Cluster (2010)",13429,318
400C100US44587,44587,"Kerman, CA Urban Cluster (2010)",13544,24
400C100US44614,44614,"Kermit, TX Urban Cluster (2010)",5781,222
400C100US44641,44641,"Kerrville, TX Urban Cluster (2010)",30924,925
400C100US44668,44668,"Ketchikan, AK Urban Cluster (2010)",10452,359
400C100US44695,44695,"Ketchum, ID Urban Cluster (2010)",3619,331
400C100US44722,44722,"Kewanee, IL Urban Cluster (2010)",12908,219
400C100US44738,44738,"Kewaunee, WI Urban Cluster (2010)",2547,168
400C100US44789,44789,"Key Largo, FL Urban Cluster (2010)",19226,809
400C100US44803,44803,"Keyser, WV--MD Urban Cluster (2010)",6959,323
400C100US44830,44830,"Keystone Heights, FL Urban Cluster (2010)",6758,714
400C100US44857,44857,"Key West, FL Urban Cluster (2010)",31738,664
400C100US44884,44884,"Kiel--New Holstein, WI Urban Cluster (2010)",7028,280
400C100US44911,44911,"Kihei, HI Urban Cluster (2010)",26864,1318
400C100US44925,44925,"Kilauea, HI Urban Cluster (2010)",3436,567
400C100US44938,44938,"Kilgore, TX Urban Cluster (2010)",15811,500
400C100US44965,44965,"Kill Devil Hills, NC Urban Cluster (2010)",18626,558
400C100US44992,44992,"Killeen, TX Urbanized Area (2010)",222668,1505
400C100US45032,45032,"Kimberling City, MO Urban Cluster (2010)",2419,395
400C100US45073,45073,"King City, CA Urban Cluster (2010)",14438,635
400C100US45100,45100,"Kingfisher, OK Urban Cluster (2010)",4197,203
400C100US45112,45112,"King George, VA Urban Cluster (2010)",3262,523
400C100US45127,45127,"Kingman, AZ Urban Cluster (2010)",42667,1344
400C100US45154,45154,"Kingman, KS Urban Cluster (2010)",2972,135
400C100US45181,45181,"Kingsland, TX Urban Cluster (2010)",6502,634
400C100US45235,45235,"Kingsport, TN--VA Urbanized Area (2010)",105792,1736
400C100US45262,45262,"Kingston, NY Urbanized Area (2010)",57418,984
400C100US45289,45289,"Kingstree, SC Urban Cluster (2010)",5832,573
400C100US45316,45316,"Kingsville, TX Urban Cluster (2010)",25210,469
400C100US45343,45343,"Kingwood, WV Urban Cluster (2010)",3124,111
400C100US45370,45370,"Kinross, MI Urban Cluster (2010)",6089,288
400C100US45397,45397,"Kinston, NC Urban Cluster (2010)",28477,828
400C100US45424,45424,"Kirksville, MO Urban Cluster (2010)",16053,301
400C100US45436,45436,"Kirtland, NM Urban Cluster (2010)",7016,951
400C100US45451,45451,"Kissimmee, FL Urbanized Area (2010)",310006,3562
400C100US45478,45478,"Kittanning--Ford City, PA Urban Cluster (2010)",14866,491
400C100US45505,45505,"Klamath Falls--Altamont, OR Urban Cluster (2010)",40863,964
400C100US45532,45532,"Knightstown, IN Urban Cluster (2010)",3096,407
400C100US45586,45586,"Knox, IN Urban Cluster (2010)",3361,135
400C100US45613,45613,"Knoxville, IA Urban Cluster (2010)",7374,39
400C100US45640,45640,"Knoxville, TN Urbanized Area (2010)",561866,2357
400C100US45667,45667,"Kodiak, AK Urban Cluster (2010)",8925,461
400C100US45694,45694,"Kokomo, IN Urbanized Area (2010)",61598,673
400C100US45721,45721,"Kosciusko, MS Urban Cluster (2010)",6917,282
400C100US45748,45748,"Kotzebue, AK Urban Cluster (2010)",3240,23
400C100US45761,45761,"Krum, TX Urban Cluster (2010)",3999,172
400C100US45775,45775,"Kuna, ID Urban Cluster (2010)",15185,325
400C100US45802,45802,"Kutztown, PA Urban Cluster (2010)",9287,468
400C100US45829,45829,"LaBelle--Port LaBelle, FL Urban Cluster (2010)",12720,1335
400C100US45844,45844,"La Center, WA Urban Cluster (2010)",2740,143
400C100US45856,45856,"Laconia, NH Urban Cluster (2010)",17994,618
400C100US45883,45883,"La Conner, WA Urban Cluster (2010)",3352,233
400C100US45910,45910,"La Crosse, WI--MN Urbanized Area (2010)",101303,465
400C100US45937,45937,"Lady Lake--The Villages, FL Urbanized Area (2010)",111730,2081
400C100US45964,45964,"Ladysmith, WI Urban Cluster (2010)",3370,99
400C100US45991,45991,"LaFayette, GA Urban Cluster (2010)",7479,261
400C100US46018,46018,"Lafayette, IN Urbanized Area (2010)",146994,736
400C100US46045,46045,"Lafayette, LA Urbanized Area (2010)",255861,1575
400C100US46099,46099,"Lafayette, TN Urban Cluster (2010)",4363,402
400C100US46126,46126,"Lafayette--Louisville--Erie, CO Urbanized Area (2010)",79528,624
400C100US46153,46153,"La Follette, TN Urban Cluster (2010)",21055,771
400C100US46180,46180,"Lago Vista, TX Urban Cluster (2010)",5473,458
400C100US46207,46207,"La Grande, OR Urban Cluster (2010)",14774,250
400C100US46234,46234,"LaGrange, GA Urban Cluster (2010)",35166,795
400C100US46261,46261,"Lagrange, IN Urban Cluster (2010)",3373,222
400C100US46315,46315,"La Grange, NC Urban Cluster (2010)",2577,237
400C100US46328,46328,"LaGrange, OH Urban Cluster (2010)",3475,300
400C100US46342,46342,"La Grange, TX Urban Cluster (2010)",5507,276
400C100US46396,46396,"Lahaina, HI Urban Cluster (2010)",19331,1147
400C100US46423,46423,"Laie--Hauula, HI Urban Cluster (2010)",13516,1057
400C100US46450,46450,"La Junta, CO Urban Cluster (2010)",8504,269
400C100US46465,46465,"Lake Arrowhead--Crestline, CA Urban Cluster (2010)",17695,1450
400C100US46477,46477,"Lake Arthur, LA Urban Cluster (2010)",2740,184
400C100US46489,46489,"Lake Bryant, FL Urban Cluster (2010)",3205,656
400C100US46504,46504,"Lake Butler, FL Urban Cluster (2010)",5040,372
400C100US46531,46531,"Lake Charles, LA Urbanized Area (2010)",143099,1382
400C100US46558,46558,"Lake City, FL Urban Cluster (2010)",24222,1086
400C100US46585,46585,"Lake City, MN Urban Cluster (2010)",5230,226
400C100US46612,46612,"Lake City, SC Urban Cluster (2010)",7892,362
400C100US46639,46639,"Lake Conroe Eastshore, TX Urban Cluster (2010)",9541,1054
400C100US46652,46652,"Lake Conroe Northshore, TX Urban Cluster (2010)",2537,643
400C100US46666,46666,"Lake Conroe Westshore, TX Urban Cluster (2010)",19484,1257
400C100US46675,46675,"Lake Crystal, MN Urban Cluster (2010)",2542,54
400C100US46684,46684,"Lake Delton, WI Urban Cluster (2010)",5528,349
400C100US46693,46693,"Lake Geneva, WI Urban Cluster (2010)",15107,453
400C100US46747,46747,"Lake Havasu City, AZ Urbanized Area (2010)",54013,512
400C100US46760,46760,"Lake Holiday, IL Urban Cluster (2010)",7106,437
400C100US46774,46774,"Lake Isabella, CA Urban Cluster (2010)",2820,565
400C100US46801,46801,"Lake Jackson--Angleton, TX Urbanized Area (2010)",74607,867
400C100US46814,46814,"Lake Lakengren, OH Urban Cluster (2010)",3247,196
400C100US46828,46828,"Lakeland, FL Urbanized Area (2010)",265131,2701
400C100US46836,46836,"Lakeland, GA Urban Cluster (2010)",3127,294
400C100US46845,46845,"Lake Land'Or, VA Urban Cluster (2010)",5570,620
400C100US46855,46855,"Lake Los Angeles, CA Urban Cluster (2010)",11450,1053
400C100US46868,46868,"Lake Meade, PA Urban Cluster (2010)",2761,335
400C100US46882,46882,"Lake Mills, WI Urban Cluster (2010)",6540,182
400C100US46895,46895,"Lake Montezuma, AZ Urban Cluster (2010)",4078,881
400C100US46909,46909,"Lake Monticello, VA Urban Cluster (2010)",9098,775
400C100US46918,46918,"Lake Murray North Shore, SC Urban Cluster (2010)",3258,292
400C100US46927,46927,"Lake Norman of Catawba, NC Urban Cluster (2010)",4685,663
400C100US46963,46963,"Lake of the Pines, CA Urban Cluster (2010)",7735,667
400C100US46972,46972,"Lake of the Woods, VA Urban Cluster (2010)",9473,567
400C100US46980,46980,"Lake of the Woods--Pinetop-Lakeside, AZ Urban Cluster (2010)",9735,880
400C100US46990,46990,"Lake Panasoffkee, FL Urban Cluster (2010)",3718,455
400C100US47000,47000,"Lake Park, GA Urban Cluster (2010)",3583,477
400C100US47010,47010,"Lake Placid, FL Urban Cluster (2010)",15768,1013
400C100US47017,47017,"Lake Placid, NY Urban Cluster (2010)",3358,538
400C100US47044,47044,"Lake Pocotopaug--East Hampton, CT Urban Cluster (2010)",9284,525
400C100US47071,47071,"Lakeport, CA Urban Cluster (2010)",15159,809
400C100US47098,47098,"Lake Providence, LA Urban Cluster (2010)",5168,287
400C100US47109,47109,"Lake Rancho Viejo, CA Urban Cluster (2010)",2303,467
400C100US47132,47132,"Lakes--Knik-Fairview--Wasilla, AK Urban Cluster (2010)",45192,1091
400C100US47142,47142,"Lake View, AL Urban Cluster (2010)",3220,503
400C100US47152,47152,"Lakeview, OR Urban Cluster (2010)",2898,323
400C100US47179,47179,"Lake Village, AR Urban Cluster (2010)",2505,118
400C100US47233,47233,"Lake Wildwood, CA Urban Cluster (2010)",7313,601
400C100US47287,47287,"Lamar, CO Urban Cluster (2010)",8037,244
400C100US47314,47314,"Lamar, MO Urban Cluster (2010)",4515,85
400C100US47395,47395,"Lamesa, TX Urban Cluster (2010)",11629,312
400C100US47422,47422,"Lampasas, TX Urban Cluster (2010)",6365,165
400C100US47449,47449,"Lanai City, HI Urban Cluster (2010)",3424,508
400C100US47476,47476,"Lancaster, KY Urban Cluster (2010)",3690,115
400C100US47503,47503,"Lancaster, OH Urban Cluster (2010)",42464,432
400C100US47530,47530,"Lancaster, PA Urbanized Area (2010)",401884,2125
400C100US47557,47557,"Lancaster, SC Urban Cluster (2010)",25054,1084
400C100US47584,47584,"Lancaster, WI Urban Cluster (2010)",3585,107
400C100US47611,47611,"Lancaster--Palmdale, CA Urbanized Area (2010)",339087,1664
400C100US47638,47638,"Lander, WY Urban Cluster (2010)",7133,229
400C100US47665,47665,"Landrum, SC--NC Urban Cluster (2010)",4456,538
400C100US47719,47719,"Lansing, MI Urbanized Area (2010)",314680,1005
400C100US47746,47746,"Lapeer, MI Urban Cluster (2010)",13207,467
400C100US47758,47758,"La Pine Northwest, OR Urban Cluster (2010)",1984,497
400C100US47827,47827,"Laramie, WY Urban Cluster (2010)",32180,278
400C100US47854,47854,"Laredo, TX Urbanized Area (2010)",236491,870
400C100US47881,47881,"Larned, KS Urban Cluster (2010)",4700,146
400C100US47908,47908,"Las Animas, CO Urban Cluster (2010)",3901,311
400C100US47935,47935,"Las Cruces, NM Urbanized Area (2010)",131084,1875
400C100US47989,47989,"Las Vegas, NM Urban Cluster (2010)",15717,546
400C100US47995,47995,"Las Vegas--Henderson, NV Urbanized Area (2010)",1891697,1672
400C100US48016,48016,"Laughlin, NV Urban Cluster (2010)",5596,622
400C100US48043,48043,"Laurel, MS Urban Cluster (2010)",25109,817
400C100US48070,48070,"Laurel, MT Urban Cluster (2010)",8654,400
400C100US48124,48124,"Laurel Lake, NJ Urban Cluster (2010)",3485,554
400C100US48151,48151,"Laurens, SC Urban Cluster (2010)",9868,485
400C100US48178,48178,"Laurinburg, NC Urban Cluster (2010)",21259,621
400C100US48205,48205,"Laurium, MI Urban Cluster (2010)",7452,318
400C100US48232,48232,"Lawrence, KS Urbanized Area (2010)",88379,245
400C100US48259,48259,"Lawrenceburg, KY Urban Cluster (2010)",11998,373
400C100US48286,48286,"Lawrenceburg, TN Urban Cluster (2010)",9920,485
400C100US48313,48313,"Lawrenceburg--Greendale--Aurora, IN Urban Cluster (2010)",12843,486
400C100US48340,48340,"Lawrenceville, IL Urban Cluster (2010)",6576,481
400C100US48367,48367,"Lawrenceville, VA Urban Cluster (2010)",4190,594
400C100US48394,48394,"Lawton, OK Urbanized Area (2010)",92141,720
400C100US48421,48421,"Lead, SD Urban Cluster (2010)",3985,220
400C100US48448,48448,"Leadville, CO Urban Cluster (2010)",5330,404
400C100US48475,48475,"Leavenworth, KS Urban Cluster (2010)",43853,554
400C100US48485,48485,"Leavenworth, WA Urban Cluster (2010)",3718,541
400C100US48502,48502,"Lebanon, IN Urban Cluster (2010)",15184,375
400C100US48529,48529,"Lebanon, KY Urban Cluster (2010)",5645,175
400C100US48556,48556,"Lebanon, MO Urban Cluster (2010)",14168,380
400C100US48637,48637,"Lebanon, OR Urban Cluster (2010)",19699,697
400C100US48664,48664,"Lebanon, PA Urbanized Area (2010)",77113,879
400C100US48691,48691,"Lebanon, TN Urban Cluster (2010)",27876,600
400C100US48718,48718,"Lebanon, VA Urban Cluster (2010)",3098,291
400C100US48728,48728,"Lebanon--Hanover, NH--VT Urban Cluster (2010)",25935,771
400C100US48745,48745,"Lee, MA Urban Cluster (2010)",7852,560
400C100US48785,48785,"Leesburg, GA Urban Cluster (2010)",4381,575
400C100US48799,48799,"Leesburg--Eustis--Tavares, FL Urbanized Area (2010)",132218,1679
400C100US48826,48826,"Lee's Summit, MO Urbanized Area (2010)",84082,907
400C100US48853,48853,"Leesville, LA Urban Cluster (2010)",9570,181
400C100US48934,48934,"Leitchfield, KY Urban Cluster (2010)",6447,422
400C100US48961,48961,"Leland, MS Urban Cluster (2010)",4884,332
400C100US48988,48988,"Le Mars, IA Urban Cluster (2010)",9156,307
400C100US49042,49042,"Lemoore Station, CA Urban Cluster (2010)",7190,621
400C100US49069,49069,"Lena, IL Urban Cluster (2010)",2559,178
400C100US49096,49096,"Leominster--Fitchburg, MA Urbanized Area (2010)",117684,1144
400C100US49109,49109,"Leonardtown, MD Urban Cluster (2010)",5093,510
400C100US49123,49123,"Le Roy, IL Urban Cluster (2010)",3437,164
400C100US49150,49150,"Le Roy, NY Urban Cluster (2010)",4154,133
400C100US49177,49177,"Le Sueur, MN Urban Cluster (2010)",3798,115
400C100US49204,49204,"Levelland, TX Urban Cluster (2010)",13692,279
400C100US49231,49231,"Lewes, DE Urban Cluster (2010)",23078,1147
400C100US49258,49258,"Lewisburg, TN Urban Cluster (2010)",10778,276
400C100US49285,49285,"Lewisburg, WV Urban Cluster (2010)",6530,392
400C100US49312,49312,"Lewiston, ID--WA Urbanized Area (2010)",52156,326
400C100US49339,49339,"Lewiston, ME Urbanized Area (2010)",58566,963
400C100US49366,49366,"Lewistown, MT Urban Cluster (2010)",6337,226
400C100US49393,49393,"Lewistown, PA Urban Cluster (2010)",21798,636
400C100US49447,49447,"Lexington, MO Urban Cluster (2010)",4336,215
400C100US49474,49474,"Lexington, NE Urban Cluster (2010)",10382,114
400C100US49528,49528,"Lexington, TN Urban Cluster (2010)",6650,439
400C100US49555,49555,"Lexington, VA Urban Cluster (2010)",8252,319
400C100US49582,49582,"Lexington-Fayette, KY Urbanized Area (2010)",291446,818
400C100US49594,49594,"Lexington Park--California--Chesapeake Ranch Estates, MD Urbanized Area (2010)",59580,1737
400C100US49609,49609,"Libby, MT Urban Cluster (2010)",4215,361
400C100US49636,49636,"Liberal, KS Urban Cluster (2010)",20568,323
400C100US49663,49663,"Liberty, NY Urban Cluster (2010)",4255,236
400C100US49690,49690,"Liberty, TX Urban Cluster (2010)",6555,649
400C100US49717,49717,"Ligonier, IN Urban Cluster (2010)",4610,372
400C100US49744,49744,"Ligonier, PA Urban Cluster (2010)",3113,315
400C100US49771,49771,"Lihue, HI Urban Cluster (2010)",15509,875
400C100US49798,49798,"Lillington, NC Urban Cluster (2010)",3164,320
400C100US49852,49852,"Lima, OH Urbanized Area (2010)",72783,827
400C100US49906,49906,"Lincoln, IL Urban Cluster (2010)",18242,1065
400C100US49933,49933,"Lincoln, NE Urbanized Area (2010)",259796,235
400C100US49934,49934,"Lincoln, ND Urban Cluster (2010)",3218,187
400C100US49960,49960,"Lincoln City, OR Urban Cluster (2010)",10710,480
400C100US49987,49987,"Lincolnton, NC Urban Cluster (2010)",23513,918
400C100US50014,50014,"Lindale--Hideaway, TX Urban Cluster (2010)",9753,537
400C100US50041,50041,"Lindsay, CA Urban Cluster (2010)",14587,611
400C100US50068,50068,"Lindsay, OK Urban Cluster (2010)",2836,25
400C100US50095,50095,"Lindsborg, KS Urban Cluster (2010)",3416,36
400C100US50122,50122,"Lindstrom--Chisago City, MN Urban Cluster (2010)",8376,469
400C100US50149,50149,"Linton, IN Urban Cluster (2010)",5800,207
400C100US50176,50176,"Lisbon, OH Urban Cluster (2010)",5649,367
400C100US50213,50213,"Litchfield, CT Urban Cluster (2010)",2578,332
400C100US50230,50230,"Litchfield, IL Urban Cluster (2010)",7099,227
400C100US50257,50257,"Litchfield, MN Urban Cluster (2010)",6715,52
400C100US50311,50311,"Little Falls, MN Urban Cluster (2010)",9126,286
400C100US50338,50338,"Little Falls, NY Urban Cluster (2010)",4963,32
400C100US50365,50365,"Littlefield, TX Urban Cluster (2010)",5417,267
400C100US50392,50392,"Little Rock, AR Urbanized Area (2010)",432228,1495
400C100US50419,50419,"Littlestown, PA Urban Cluster (2010)",6450,215
400C100US50446,50446,"Littleton, NH Urban Cluster (2010)",3447,382
400C100US50473,50473,"Live Oak (Sutter County), CA Urban Cluster (2010)",8676,159
400C100US50500,50500,"Live Oak, FL Urban Cluster (2010)",7087,500
400C100US50527,50527,"Livermore, CA Urbanized Area (2010)",81691,323
400C100US50554,50554,"Livermore Falls, ME Urban Cluster (2010)",2833,402
400C100US50608,50608,"Livingston, MT Urban Cluster (2010)",8340,385
400C100US50635,50635,"Livingston, TN Urban Cluster (2010)",3677,196
400C100US50662,50662,"Livingston, TX Urban Cluster (2010)",5007,272
400C100US50679,50679,"Livonia, LA Urban Cluster (2010)",4052,503
400C100US50716,50716,"Llano, TX Urban Cluster (2010)",2933,192
400C100US50730,50730,"Lochbuie, CO Urban Cluster (2010)",4538,199
400C100US50743,50743,"Lockhart, TX Urban Cluster (2010)",12461,177
400C100US50770,50770,"Lock Haven, PA Urban Cluster (2010)",17502,335
400C100US50797,50797,"Lockport, NY Urban Cluster (2010)",35611,637
400C100US50813,50813,"Locust, NC Urban Cluster (2010)",3186,356
400C100US50851,50851,"Lodi, CA Urbanized Area (2010)",68230,779
400C100US50878,50878,"Lodi, OH Urban Cluster (2010)",2699,63
400C100US50905,50905,"Lodi, WI Urban Cluster (2010)",3004,58
400C100US50932,50932,"Logan, OH Urban Cluster (2010)",7953,266
400C100US50959,50959,"Logan, UT Urbanized Area (2010)",95001,539
400C100US50986,50986,"Logan, WV Urban Cluster (2010)",10445,905
400C100US51013,51013,"Logansport, IN Urban Cluster (2010)",21182,377
400C100US51026,51026,"Lolo, MT Urban Cluster (2010)",2300,471
400C100US51040,51040,"Lompoc, CA Urbanized Area (2010)",51877,698
400C100US51121,51121,"London, OH Urban Cluster (2010)",13968,458
400C100US51131,51131,"London--Corbin, KY Urban Cluster (2010)",37488,1304
400C100US51142,51142,"Long Beach, MD Urban Cluster (2010)",5698,578
400C100US51175,51175,"Longmont, CO Urbanized Area (2010)",91401,729
400C100US51202,51202,"Long Neck, DE Urban Cluster (2010)",15621,945
400C100US51229,51229,"Long Prairie, MN Urban Cluster (2010)",3383,38
400C100US51256,51256,"Longview, TX Urbanized Area (2010)",100204,1130
400C100US51283,51283,"Longview, WA--OR Urbanized Area (2010)",63334,836
400C100US51310,51310,"Lonoke, AR Urban Cluster (2010)",4192,47
400C100US51322,51322,"Lonsdale, MN Urban Cluster (2010)",3298,121
400C100US51337,51337,"Loogootee, IN Urban Cluster (2010)",3168,318
400C100US51364,51364,"Lorain--Elyria, OH Urbanized Area (2010)",182293,698
400C100US51418,51418,"Los Alamos, NM Urban Cluster (2010)",10834,422
400C100US51445,51445,"Los Angeles--Long Beach--Anaheim, CA Urbanized Area (2010)",12191269,3520
400C100US51472,51472,"Los Banos, CA Urban Cluster (2010)",35614,309
400C100US51499,51499,"Los Lunas, NM Urbanized Area (2010)",64667,896
400C100US51513,51513,"Los Molinos, CA Urban Cluster (2010)",3847,579
400C100US51580,51580,"Louisa, KY--WV Urban Cluster (2010)",4618,507
400C100US51607,51607,"Louisburg, KS Urban Cluster (2010)",3972,129
400C100US51634,51634,"Louisburg, NC Urban Cluster (2010)",3652,204
400C100US51661,51661,"Louisiana, MO Urban Cluster (2010)",3123,102
400C100US51688,51688,"Louisville, GA Urban Cluster (2010)",3673,582
400C100US51742,51742,"Louisville, MS Urban Cluster (2010)",4184,380
400C100US51755,51755,"Louisville/Jefferson County, KY--IN Urbanized Area (2010)",972467,1398
400C100US51769,51769,"Lovington, NM Urban Cluster (2010)",11433,187
400C100US51796,51796,"Lowell, IN Urban Cluster (2010)",10105,580
400C100US51823,51823,"Lowell, MI Urban Cluster (2010)",6515,336
400C100US51850,51850,"Lowville, NY Urban Cluster (2010)",3892,260
400C100US51877,51877,"Lubbock, TX Urbanized Area (2010)",236493,1402
400C100US51904,51904,"Lucasville, OH Urban Cluster (2010)",3368,376
