GEO.id,GEO.id2,GEO.display-label,HD01_VD01,HD02_VD01
400C100US00037,00037,"Abbeville, LA Urban Cluster (2010)",19917,641
400C100US00064,00064,"Abbeville, SC Urban Cluster (2010)",5087,232
400C100US00091,00091,"Abbotsford, WI Urban Cluster (2010)",3349,275
400C100US00118,00118,"Aberdeen, MS Urban Cluster (2010)",4710,245
400C100US00145,00145,"Aberdeen, SD Urban Cluster (2010)",26208,109
400C100US00172,00172,"Aberdeen, WA Urban Cluster (2010)",29868,504
400C100US00199,00199,"Aberdeen--Bel Air South--Bel Air North, MD Urbanized Area (2010)",213210,1303
400C100US00226,00226,"Abernathy, TX Urban Cluster (2010)",2589,381
400C100US00253,00253,"Abilene, KS Urban Cluster (2010)",7090,134
400C100US00280,00280,"Abilene, TX Urbanized Area (2010)",110397,653
400C100US00334,00334,"Abingdon, IL Urban Cluster (2010)",3185,238
400C100US00388,00388,"Ada, OH Urban Cluster (2010)",5977,272
400C100US00415,00415,"Ada, OK Urban Cluster (2010)",16979,328
400C100US00450,00450,"Adams, NY Urban Cluster (2010)",2309,402
400C100US00469,00469,"Adel, GA Urban Cluster (2010)",7419,403
400C100US00496,00496,"Adel, IA Urban Cluster (2010)",3340,179
400C100US00577,00577,"Adrian, MI Urban Cluster (2010)",45020,691
400C100US00658,00658,"Ahoskie, NC Urban Cluster (2010)",4888,141
400C100US00676,00676,"Air Force Academy, CO Urban Cluster (2010)",3492,360
400C100US00712,00712,"Ajo, AZ Urban Cluster (2010)",3290,392
400C100US00739,00739,"Akron, NY Urban Cluster (2010)",2910,54
400C100US00766,00766,"Akron, OH Urbanized Area (2010)",569093,1656
400C100US00793,00793,"Alachua, FL Urban Cluster (2010)",3883,557
400C100US00820,00820,"Alamogordo, NM Urban Cluster (2010)",31494,387
400C100US00847,00847,"Alamosa, CO Urban Cluster (2010)",10154,345
400C100US00901,00901,"Albany, GA Urbanized Area (2010)",95369,1139
400C100US00921,00921,"Albany, MN Urban Cluster (2010)",2563,64
400C100US00955,00955,"Albany, OR Urbanized Area (2010)",57102,559
400C100US00970,00970,"Albany--Schenectady, NY Urbanized Area (2010)",596668,1927
400C100US00982,00982,"Albemarle, NC Urban Cluster (2010)",17130,390
400C100US01009,01009,"Albert Lea, MN Urban Cluster (2010)",17797,124
400C100US01036,01036,"Albertville, AL Urban Cluster (2010)",36759,1060
400C100US01063,01063,"Albia, IA Urban Cluster (2010)",3706,62
400C100US01090,01090,"Albion, MI Urban Cluster (2010)",9150,153
400C100US01117,01117,"Albion, NY Urban Cluster (2010)",8272,391
400C100US01144,01144,"Albion, PA Urban Cluster (2010)",4304,258
400C100US01171,01171,"Albuquerque, NM Urbanized Area (2010)",741981,1672
400C100US01198,01198,"Alderson, WV Urban Cluster (2010)",2295,334
400C100US01225,01225,"Aledo, IL Urban Cluster (2010)",3739,156
400C100US01232,01232,"Aledo, TX Urban Cluster (2010)",5331,333
400C100US01252,01252,"Alexander City, AL Urban Cluster (2010)",9448,648
400C100US01279,01279,"Alexandria, LA Urbanized Area (2010)",82349,1254
400C100US01306,01306,"Alexandria, MN Urban Cluster (2010)",17363,359
400C100US01333,01333,"Alfred, NY Urban Cluster (2010)",4545,211
400C100US01360,01360,"Algoma, WI Urban Cluster (2010)",3026,138
400C100US01387,01387,"Algona, IA Urban Cluster (2010)",5356,99
400C100US01414,01414,"Alice, TX Urban Cluster (2010)",21745,577
400C100US01441,01441,"Allegan, MI Urban Cluster (2010)",6240,366
400C100US01468,01468,"Allendale, SC Urban Cluster (2010)",3231,286
400C100US01495,01495,"Allentown, PA--NJ Urbanized Area (2010)",664615,1768
400C100US01522,01522,"Alliance, NE Urban Cluster (2010)",8519,25
400C100US01549,01549,"Alliance, OH Urban Cluster (2010)",32330,484
400C100US01603,01603,"Alma, GA Urban Cluster (2010)",3468,315
400C100US01630,01630,"Alma--St. Louis, MI Urban Cluster (2010)",17127,325
400C100US01657,01657,"Almont, MI Urban Cluster (2010)",2753,79
400C100US01684,01684,"Alpena, MI Urban Cluster (2010)",14066,306
400C100US01711,01711,"Alpine, TX Urban Cluster (2010)",5918,138
400C100US01738,01738,"Altavista, VA Urban Cluster (2010)",4662,296
400C100US01765,01765,"Alton, IL--MO Urbanized Area (2010)",83986,638
400C100US01792,01792,"Altoona, PA Urbanized Area (2010)",81184,859
400C100US01819,01819,"Alturas, CA Urban Cluster (2010)",2630,183
400C100US01846,01846,"Altus, OK Urban Cluster (2010)",19719,187
400C100US01873,01873,"Alva, OK Urban Cluster (2010)",5524,302
400C100US01900,01900,"Alvarado, TX Urban Cluster (2010)",3888,286
400C100US01927,01927,"Amarillo, TX Urbanized Area (2010)",194765,751
400C100US01981,01981,"American Falls, ID Urban Cluster (2010)",4382,18
400C100US02008,02008,"Americus, GA Urban Cluster (2010)",18667,567
400C100US02035,02035,"Amery, WI Urban Cluster (2010)",2836,87
400C100US02062,02062,"Ames, IA Urbanized Area (2010)",61129,487
400C100US02116,02116,"Amite City, LA Urban Cluster (2010)",6278,621
400C100US02143,02143,"Amory, MS Urban Cluster (2010)",6522,274
400C100US02170,02170,"Amsterdam, NY Urban Cluster (2010)",21839,374
400C100US02197,02197,"Anaconda-Deer Lodge County, MT Urban Cluster (2010)",6231,449
400C100US02224,02224,"Anacortes, WA Urban Cluster (2010)",16633,172
400C100US02251,02251,"Anadarko, OK Urban Cluster (2010)",6117,239
400C100US02278,02278,"Anamosa, IA Urban Cluster (2010)",5602,108
400C100US02305,02305,"Anchorage, AK Urbanized Area (2010)",250105,1198
400C100US02332,02332,"Anchorage Northeast, AK Urban Cluster (2010)",28913,1091
400C100US02359,02359,"Andalusia, AL Urban Cluster (2010)",6601,382
400C100US02386,02386,"Anderson, IN Urbanized Area (2010)",87463,864
400C100US02413,02413,"Anderson, SC Urbanized Area (2010)",76472,1413
400C100US02440,02440,"Andrews, SC Urban Cluster (2010)",4317,509
400C100US02467,02467,"Andrews, TX Urban Cluster (2010)",12619,358
400C100US02494,02494,"Angels, CA Urban Cluster (2010)",3728,93
400C100US02548,02548,"Angola, IN Urban Cluster (2010)",11283,402
400C100US02575,02575,"Anna, IL Urban Cluster (2010)",6057,299
400C100US02581,02581,"Anna, TX Urban Cluster (2010)",10851,540
400C100US02590,02590,"Annandale, MN Urban Cluster (2010)",3265,30
400C100US02602,02602,"Ann Arbor, MI Urbanized Area (2010)",308004,1267
400C100US02629,02629,"Anniston--Oxford, AL Urbanized Area (2010)",79794,1070
400C100US02656,02656,"Antigo, WI Urban Cluster (2010)",8166,169
400C100US02683,02683,"Antioch, CA Urbanized Area (2010)",278183,1413
400C100US02710,02710,"Apalachicola, FL Urban Cluster (2010)",3672,445
400C100US02764,02764,"Appleton, WI Urbanized Area (2010)",215927,935
400C100US02773,02773,"Apple Valley, OH Urban Cluster (2010)",5045,416
400C100US02791,02791,"Arab, AL Urban Cluster (2010)",7713,362
400C100US02825,02825,"Arbuckle, CA Urban Cluster (2010)",3063,421
400C100US02845,02845,"Arcade, NY Urban Cluster (2010)",3008,359
400C100US02899,02899,"Arcadia, LA Urban Cluster (2010)",2856,112
400C100US02901,02901,"Arcadia, WI Urban Cluster (2010)",2972,135
400C100US02912,02912,"Arcadia--Southeast Arcadia, FL Urban Cluster (2010)",18045,1042
400C100US02926,02926,"Arcata-McKinleyville, CA Urban Cluster (2010)",34083,921
400C100US02953,02953,"Archbold, OH Urban Cluster (2010)",4624,291
400C100US02965,02965,"Archer Lodge--Clayton, NC Urban Cluster (2010)",12815,1188
400C100US02980,02980,"Arcola, IL Urban Cluster (2010)",2836,205
400C100US03007,03007,"Ardmore, OK Urban Cluster (2010)",20864,476
400C100US03088,03088,"Arizona City, AZ Urban Cluster (2010)",8026,1224
400C100US03115,03115,"Arkadelphia, AR Urban Cluster (2010)",10521,156
400C100US03142,03142,"Arkansas City, KS Urban Cluster (2010)",12700,255
400C100US03158,03158,"Arlington, TN Urban Cluster (2010)",11263,502
400C100US03196,03196,"Arroyo Grande--Grover Beach, CA Urbanized Area (2010)",53386,1029
400C100US03223,03223,"Artesia, NM Urban Cluster (2010)",12463,483
400C100US03250,03250,"Arvin, CA Urban Cluster (2010)",19428,93
400C100US03277,03277,"Ashburn, GA Urban Cluster (2010)",4173,320
400C100US03304,03304,"Ashdown, AR Urban Cluster (2010)",4307,298
400C100US03331,03331,"Asheboro, NC Urban Cluster (2010)",37779,1012
400C100US03358,03358,"Asheville, NC Urbanized Area (2010)",282102,2675
400C100US03365,03365,"Ashland, MO Urban Cluster (2010)",3640,51
400C100US03375,03375,"Ashland, NE Urban Cluster (2010)",2521,176
400C100US03385,03385,"Ashland, OH Urban Cluster (2010)",20239,178
400C100US03395,03395,"Ashland, PA Urban Cluster (2010)",7741,401
400C100US03412,03412,"Ashland, WI Urban Cluster (2010)",7350,177
400C100US03439,03439,"Ashland City, TN Urban Cluster (2010)",3054,376
400C100US03466,03466,"Ashtabula, OH Urban Cluster (2010)",29185,449
400C100US03493,03493,"Ashville, OH Urban Cluster (2010)",6358,277
400C100US03520,03520,"Aspen, CO Urban Cluster (2010)",7431,229
400C100US03547,03547,"Astoria, OR Urban Cluster (2010)",14494,482
400C100US03601,03601,"Atchison, KS--MO Urban Cluster (2010)",11153,318
400C100US03655,03655,"Athens, AL Urban Cluster (2010)",24648,831
400C100US03682,03682,"Athens, OH Urban Cluster (2010)",28287,466
400C100US03709,03709,"Athens, TN Urban Cluster (2010)",16148,657
400C100US03736,03736,"Athens, TX Urban Cluster (2010)",12378,519
400C100US03763,03763,"Athens-Clarke County, GA Urbanized Area (2010)",127811,1426
400C100US03790,03790,"Athol, MA Urban Cluster (2010)",12062,726
400C100US03817,03817,"Atlanta, GA Urbanized Area (2010)",4537107,5413
400C100US03844,03844,"Atlanta, TX Urban Cluster (2010)",5752,288
400C100US03871,03871,"Atlantic, IA Urban Cluster (2010)",6408,190
400C100US03898,03898,"Atlantic City, NJ Urbanized Area (2010)",248991,1419
400C100US03925,03925,"Atmore, AL Urban Cluster (2010)",6867,471
400C100US03957,03957,"Atoka, TN Urban Cluster (2010)",18976,711
400C100US03979,03979,"Attica, IN Urban Cluster (2010)",5875,316
400C100US04006,04006,"Attica, NY Urban Cluster (2010)",4419,337
400C100US04021,04021,"Aubrey, TX Urban Cluster (2010)",4085,317
400C100US04033,04033,"Auburn, AL Urbanized Area (2010)",75055,908
400C100US04054,04054,"Auburn, IL Urban Cluster (2010)",4691,326
400C100US04060,04060,"Auburn, IN Urban Cluster (2010)",21373,513
400C100US04087,04087,"Auburn, NE Urban Cluster (2010)",3514,40
400C100US04114,04114,"Auburn, NY Urban Cluster (2010)",31947,452
400C100US04130,04130,"Auburn--North Auburn, CA Urban Cluster (2010)",33921,1110
400C100US04168,04168,"Augusta, KS Urban Cluster (2010)",9241,27
400C100US04195,04195,"Augusta, ME Urban Cluster (2010)",23968,764
400C100US04222,04222,"Augusta-Richmond County, GA--SC Urbanized Area (2010)",388593,2567
400C100US04249,04249,"Aumsville, OR Urban Cluster (2010)",3970,275
400C100US04276,04276,"Aurora, MO Urban Cluster (2010)",8447,329
400C100US04303,04303,"Aurora, NE Urban Cluster (2010)",4445,37
400C100US04330,04330,"Au Sable, MI Urban Cluster (2010)",6540,318
400C100US04357,04357,"Austin, MN Urban Cluster (2010)",25189,178
400C100US04384,04384,"Austin, TX Urbanized Area (2010)",1378672,3365
400C100US04411,04411,"Ava, MO Urban Cluster (2010)",2991,47
400C100US04438,04438,"Avalon, CA Urban Cluster (2010)",3626,86
400C100US04465,04465,"Avenal, CA Urban Cluster (2010)",15331,37
400C100US04519,04519,"Avon, NY Urban Cluster (2010)",4596,340
400C100US04549,04549,"Avondale--Goodyear, AZ Urbanized Area (2010)",195947,2008
400C100US04573,04573,"Avra Valley, AZ Urban Cluster (2010)",3596,720
400C100US04587,04587,"Aztec, NM Urban Cluster (2010)",8692,605
400C100US04600,04600,"Bad Axe, MI Urban Cluster (2010)",3430,102
400C100US04627,04627,"Bainbridge, GA Urban Cluster (2010)",12307,497
400C100US04654,04654,"Baker City, OR Urban Cluster (2010)",9643,121
400C100US04681,04681,"Bakersfield, CA Urbanized Area (2010)",527139,2349
400C100US04708,04708,"Bald Knob, AR Urban Cluster (2010)",2489,206
400C100US04762,04762,"Baldwin, WI Urban Cluster (2010)",5762,356
400C100US04789,04789,"Baldwin City, KS Urban Cluster (2010)",4420,85
400C100US04816,04816,"Ballinger, TX Urban Cluster (2010)",3587,145
400C100US04843,04843,"Baltimore, MD Urbanized Area (2010)",2205667,2765
400C100US04870,04870,"Baltimore, OH Urban Cluster (2010)",3531,181
400C100US04897,04897,"Bamberg, SC Urban Cluster (2010)",3369,147
400C100US04924,04924,"Bandon, OR Urban Cluster (2010)",3116,181
400C100US04951,04951,"Bangor, ME Urbanized Area (2010)",61116,936
400C100US05005,05005,"Baraboo, WI Urban Cluster (2010)",13954,328
400C100US05032,05032,"Barbourville, KY Urban Cluster (2010)",5629,587
400C100US05059,05059,"Bardstown, KY Urban Cluster (2010)",18959,730
400C100US05086,05086,"Bar Harbor, ME Urban Cluster (2010)",2723,311
400C100US05113,05113,"Barnesville, GA Urban Cluster (2010)",6980,177
400C100US05140,05140,"Barnesville, OH Urban Cluster (2010)",4216,378
400C100US05167,05167,"Barnstable Town, MA Urbanized Area (2010)",245370,1630
400C100US05194,05194,"Barnwell, SC Urban Cluster (2010)",3689,334
400C100US05221,05221,"Barre--Montpelier, VT Urban Cluster (2010)",21464,532
400C100US05248,05248,"Barron, WI Urban Cluster (2010)",3079,150
400C100US05275,05275,"Barrow, AK Urban Cluster (2010)",3965,119
400C100US05302,05302,"Barstow, CA Urban Cluster (2010)",29899,1073
400C100US05329,05329,"Bartlesville, OK Urban Cluster (2010)",38761,207
400C100US05356,05356,"Bartlett, TX Urban Cluster (2010)",1150,223
400C100US05410,05410,"Basalt--El Jebel, CO Urban Cluster (2010)",9559,831
400C100US05423,05423,"Basehor, KS Urban Cluster (2010)",4103,261
400C100US05437,05437,"Bastrop, LA Urban Cluster (2010)",14027,399
400C100US05464,05464,"Bastrop, TX Urban Cluster (2010)",12749,915
400C100US05491,05491,"Batavia, NY Urban Cluster (2010)",17499,445
400C100US05518,05518,"Batesburg-Leesville, SC Urban Cluster (2010)",5222,501
400C100US05545,05545,"Batesville, AR Urban Cluster (2010)",11652,651
400C100US05572,05572,"Batesville, IN Urban Cluster (2010)",7625,421
400C100US05599,05599,"Batesville, MS Urban Cluster (2010)",6664,390
400C100US05653,05653,"Bath, NY Urban Cluster (2010)",7024,283
400C100US05680,05680,"Baton Rouge, LA Urbanized Area (2010)",595150,2943
400C100US05707,05707,"Battle Creek, MI Urbanized Area (2010)",78005,890
400C100US05734,05734,"Battlement Mesa, CO Urban Cluster (2010)",5374,568
400C100US05761,05761,"Battle Mountain, NV Urban Cluster (2010)",3505,383
400C100US05788,05788,"Baxley, GA Urban Cluster (2010)",5347,446
400C100US05815,05815,"Baxter Springs, KS Urban Cluster (2010)",5091,205
400C100US05842,05842,"Bayard, NM Urban Cluster (2010)",4474,455
400C100US05869,05869,"Bay City, MI Urbanized Area (2010)",71121,607
400C100US05896,05896,"Bay City, TX Urban Cluster (2010)",18993,602
400C100US05904,05904,"Bayfield, CO Urban Cluster (2010)",2300,387
400C100US05923,05923,"Bay Minette, AL Urban Cluster (2010)",7285,344
400C100US05958,05958,"Bealeton, VA Urban Cluster (2010)",7108,853
400C100US05977,05977,"Beardstown, IL Urban Cluster (2010)",6539,142
400C100US06004,06004,"Beatrice, NE Urban Cluster (2010)",12280,147
400C100US06031,06031,"Beaufort--Port Royal, SC Urban Cluster (2010)",47194,1424
400C100US06058,06058,"Beaumont, TX Urbanized Area (2010)",147678,1484
400C100US06076,06076,"Beaver, UT Urban Cluster (2010)",2758,257
400C100US06085,06085,"Beaver Dam, KY Urban Cluster (2010)",6368,247
400C100US06112,06112,"Beaver Dam, WI Urban Cluster (2010)",17655,217
400C100US06128,06128,"Becker, MN Urban Cluster (2010)",3712,248
400C100US06139,06139,"Beckley, WV Urbanized Area (2010)",61628,1562
400C100US06166,06166,"Bedford, IN Urban Cluster (2010)",14871,394
400C100US06186,06186,"Bedford, NY Urban Cluster (2010)",2807,378
400C100US06193,06193,"Bedford, PA Urban Cluster (2010)",4226,335
400C100US06220,06220,"Bedford, VA Urban Cluster (2010)",7314,499
400C100US06247,06247,"Beebe, AR Urban Cluster (2010)",6723,212
400C100US06261,06261,"Beecher, IL Urban Cluster (2010)",4584,327
400C100US06274,06274,"Beeville, TX Urban Cluster (2010)",17717,701
400C100US06301,06301,"Belding, MI Urban Cluster (2010)",5845,90
400C100US06335,06335,"Belfair, WA Urban Cluster (2010)",3569,748
400C100US06355,06355,"Belfast, ME Urban Cluster (2010)",3323,537
400C100US06382,06382,"Belgrade, MT Urban Cluster (2010)",13991,666
400C100US06436,06436,"Bellefontaine, OH Urban Cluster (2010)",13293,399
400C100US06463,06463,"Bellefonte, PA Urban Cluster (2010)",12774,624
400C100US06490,06490,"Belle Fourche, SD Urban Cluster (2010)",5407,166
400C100US06517,06517,"Belle Glade, FL Urban Cluster (2010)",24310,640
400C100US06571,06571,"Belle Plaine, MN Urban Cluster (2010)",6238,180
400C100US06598,06598,"Bellevue, IA Urban Cluster (2010)",2741,290
400C100US06625,06625,"Bellevue, OH Urban Cluster (2010)",8213,90
400C100US06652,06652,"Bellingham, WA Urbanized Area (2010)",114811,1312
400C100US06679,06679,"Bellows Falls, VT--NH Urban Cluster (2010)",5727,423
400C100US06692,06692,"Bells, TN Urban Cluster (2010)",4247,459
400C100US06706,06706,"Bellville, TX Urban Cluster (2010)",4069,126
400C100US06733,06733,"Beloit, KS Urban Cluster (2010)",3295,149
400C100US06760,06760,"Beloit, WI--IL Urbanized Area (2010)",63162,689
400C100US06770,06770,"Belterra, TX Urban Cluster (2010)",4028,565
400C100US06779,06779,"Belton, SC Urban Cluster (2010)",5310,290
400C100US06787,06787,"Belvidere, NJ--PA Urban Cluster (2010)",3857,143
400C100US06814,06814,"Belzoni, MS Urban Cluster (2010)",5033,453
400C100US06841,06841,"Bemidji, MN Urban Cluster (2010)",14353,405
400C100US06868,06868,"Bend, OR Urbanized Area (2010)",84044,799
400C100US06895,06895,"Bennettsville, SC Urban Cluster (2010)",12049,484
400C100US06922,06922,"Bennington, VT Urban Cluster (2010)",12457,494
400C100US06949,06949,"Benson, AZ Urban Cluster (2010)",3990,346
400C100US06976,06976,"Benson, MN Urban Cluster (2010)",3162,35
400C100US07003,07003,"Benson, NC Urban Cluster (2010)",3226,121
400C100US07030,07030,"Benton, IL Urban Cluster (2010)",8092,311
400C100US07057,07057,"Benton, KY Urban Cluster (2010)",4538,340
400C100US07084,07084,"Benton, LA Urban Cluster (2010)",5436,697
400C100US07111,07111,"Benton City, WA Urban Cluster (2010)",3927,364
400C100US07138,07138,"Benton Harbor--St. Joseph--Fair Plain, MI Urbanized Area (2010)",60831,578
400C100US07165,07165,"Berea, KY Urban Cluster (2010)",16221,797
400C100US07192,07192,"Berlin, NH Urban Cluster (2010)",10599,339
400C100US07219,07219,"Berlin, WI Urban Cluster (2010)",4812,198
400C100US07246,07246,"Berne, IN Urban Cluster (2010)",5374,401
400C100US07273,07273,"Berrien Springs, MI Urban Cluster (2010)",7543,482
400C100US07300,07300,"Berryville, AR Urban Cluster (2010)",4645,271
400C100US07327,07327,"Berryville, VA Urban Cluster (2010)",4035,166
400C100US07354,07354,"Bethany, MO Urban Cluster (2010)",2600,242
400C100US07381,07381,"Bethel, AK Urban Cluster (2010)",4751,360
400C100US07408,07408,"Bethel, OH Urban Cluster (2010)",3454,385
400C100US07462,07462,"Beulah, ND Urban Cluster (2010)",2924,107
400C100US07489,07489,"Bicknell, IN Urban Cluster (2010)",3515,268
400C100US07508,07508,"Big Bear City, CA Urban Cluster (2010)",15424,1427
400C100US07543,07543,"Big Lake, TX Urban Cluster (2010)",3148,89
400C100US07597,07597,"Big Pine Key, FL Urban Cluster (2010)",7304,714
400C100US07624,07624,"Big Rapids, MI Urban Cluster (2010)",14000,495
400C100US07651,07651,"Big Spring, TX Urban Cluster (2010)",27796,290
400C100US07678,07678,"Big Stone Gap, VA Urban Cluster (2010)",9005,636
400C100US07705,07705,"Billings, MT Urbanized Area (2010)",114741,858
400C100US07732,07732,"Binghamton, NY--PA Urbanized Area (2010)",158107,1186
400C100US07759,07759,"Birch Bay, WA Urban Cluster (2010)",12627,743
400C100US07786,07786,"Birmingham, AL Urbanized Area (2010)",751820,2317
400C100US07813,07813,"Bisbee, AZ Urban Cluster (2010)",5640,302
400C100US07824,07824,"Biscoe, NC Urban Cluster (2010)",3168,526
400C100US07840,07840,"Bishop, CA Urban Cluster (2010)",9998,408
400C100US07867,07867,"Bishop, TX Urban Cluster (2010)",3073,65
400C100US07894,07894,"Bishopville, SC Urban Cluster (2010)",4410,274
400C100US07921,07921,"Bismarck, ND Urbanized Area (2010)",82115,545
400C100US07948,07948,"Blackfoot, ID Urban Cluster (2010)",15308,553
400C100US07975,07975,"Black River Falls, WI Urban Cluster (2010)",5663,169
400C100US08002,08002,"Blacksburg, VA Urbanized Area (2010)",88005,799
400C100US08029,08029,"Blackshear, GA Urban Cluster (2010)",3886,269
400C100US08056,08056,"Blackstone, VA Urban Cluster (2010)",3009,346
400C100US08083,08083,"Blackwell, OK Urban Cluster (2010)",6680,226
400C100US08137,08137,"Blair, NE Urban Cluster (2010)",8047,120
400C100US08164,08164,"Blairsville, PA Urban Cluster (2010)",7038,327
400C100US08191,08191,"Blakely, GA Urban Cluster (2010)",3824,314
400C100US08209,08209,"Blanchard, OK Urban Cluster (2010)",3291,428
400C100US08218,08218,"Blanchester, OH Urban Cluster (2010)",4201,314
400C100US08245,08245,"Blanding, UT Urban Cluster (2010)",3180,167
400C100US08272,08272,"Blissfield, MI Urban Cluster (2010)",3270,216
400C100US08299,08299,"Bloomer, WI Urban Cluster (2010)",3299,124
400C100US08326,08326,"Bloomfield, IN Urban Cluster (2010)",2683,269
400C100US08353,08353,"Bloomfield, NM Urban Cluster (2010)",9517,715
400C100US08380,08380,"Bloomington, IN Urbanized Area (2010)",108595,940
400C100US08407,08407,"Bloomington--Normal, IL Urbanized Area (2010)",132773,454
400C100US08434,08434,"Bloomsburg--Berwick, PA Urbanized Area (2010)",53233,644
400C100US08461,08461,"Blountstown, FL Urban Cluster (2010)",3867,401
400C100US08488,08488,"Blue Earth, MN Urban Cluster (2010)",3251,61
400C100US08515,08515,"Bluefield, WV--VA Urban Cluster (2010)",43144,941
400C100US08542,08542,"Bluffton, IN Urban Cluster (2010)",9711,313
400C100US08569,08569,"Bluffton, OH Urban Cluster (2010)",3980,209
400C100US08623,08623,"Blythe, CA--AZ Urban Cluster (2010)",12974,604
400C100US08650,08650,"Blytheville, AR Urban Cluster (2010)",18552,516
400C100US08677,08677,"Boardman, OR Urban Cluster (2010)",3283,70
400C100US08704,08704,"Boerne, TX Urban Cluster (2010)",10874,568
400C100US08731,08731,"Bogalusa, LA Urban Cluster (2010)",12209,224
400C100US08749,08749,"Boiling Spring Lakes, NC Urban Cluster (2010)",4633,288
400C100US08758,08758,"Boiling Springs, NC Urban Cluster (2010)",3904,435
400C100US08785,08785,"Boise City, ID Urbanized Area (2010)",354240,1445
400C100US08812,08812,"Bolivar, MO Urban Cluster (2010)",9272,491
400C100US08839,08839,"Bolivar, OH Urban Cluster (2010)",3949,164
400C100US08866,08866,"Bolivar, TN Urban Cluster (2010)",4899,291
400C100US08893,08893,"Bonadelle Ranchos-Madera Ranchos, CA Urban Cluster (2010)",7768,605
400C100US08920,08920,"Bonham, TX Urban Cluster (2010)",9884,111
400C100US08947,08947,"Bonifay, FL Urban Cluster (2010)",4021,369
400C100US08974,08974,"Bonita Springs, FL Urbanized Area (2010)",313293,2699
400C100US08992,08992,"Bonneauville, PA Urban Cluster (2010)",5048,506
400C100US09001,09001,"Bonners Ferry, ID Urban Cluster (2010)",2589,51
400C100US09028,09028,"Boone, IA Urban Cluster (2010)",12823,119
400C100US09055,09055,"Boone, NC Urban Cluster (2010)",22883,576
400C100US09082,09082,"Booneville, AR Urban Cluster (2010)",3307,246
400C100US09109,09109,"Booneville, MS Urban Cluster (2010)",6419,484
400C100US09163,09163,"Boonville, IN Urban Cluster (2010)",6374,217
400C100US09190,09190,"Boonville, MO Urban Cluster (2010)",9248,261
400C100US09217,09217,"Borger, TX Urban Cluster (2010)",13552,182
400C100US09244,09244,"Boscobel, WI Urban Cluster (2010)",3252,88
400C100US09271,09271,"Boston, MA--NH--RI Urbanized Area (2010)",4190725,2950
400C100US09298,09298,"Boulder, CO Urbanized Area (2010)",116572,773
400C100US09325,09325,"Boulder City, NV Urban Cluster (2010)",14134,245
400C100US09352,09352,"Bowie, TX Urban Cluster (2010)",4949,361
400C100US09379,09379,"Bowling Green, KY Urbanized Area (2010)",79263,1146
400C100US09406,09406,"Bowling Green, MO Urban Cluster (2010)",5363,88
400C100US09433,09433,"Bowling Green, OH Urban Cluster (2010)",31649,464
400C100US09460,09460,"Box Elder, SD Urban Cluster (2010)",8031,393
400C100US09487,09487,"Boyne City, MI Urban Cluster (2010)",3690,90
400C100US09514,09514,"Bozeman, MT Urban Cluster (2010)",43425,699
400C100US09532,09532,"Brackettville, TX Urban Cluster (2010)",2901,233
400C100US09541,09541,"Bradford, PA--NY Urban Cluster (2010)",11686,294
400C100US09568,09568,"Brady, TX Urban Cluster (2010)",5377,199
400C100US09600,09600,"Braidwood--Coal City--Wilmington, IL Urban Cluster (2010)",22768,509
400C100US09622,09622,"Brainerd, MN Urban Cluster (2010)",19901,471
400C100US09649,09649,"Brandon, SD Urban Cluster (2010)",8088,226
400C100US09676,09676,"Branson, MO Urban Cluster (2010)",22488,850
400C100US09703,09703,"Brattleboro, VT--NH Urban Cluster (2010)",9806,390
400C100US09730,09730,"Brawley, CA Urban Cluster (2010)",25084,148
400C100US09784,09784,"Brazoria, TX Urban Cluster (2010)",3995,336
400C100US09801,09801,"Breaux Bridge, LA Urban Cluster (2010)",17233,1034
400C100US09811,09811,"Breckenridge, CO Urban Cluster (2010)",6734,629
400C100US09838,09838,"Breckenridge, TX Urban Cluster (2010)",5764,123
400C100US09865,09865,"Breese, IL Urban Cluster (2010)",6050,208
400C100US09892,09892,"Bremen, GA Urban Cluster (2010)",6244,378
400C100US09919,09919,"Bremen, IN Urban Cluster (2010)",4713,73
400C100US09946,09946,"Bremerton, WA Urbanized Area (2010)",199550,1455
400C100US09973,09973,"Brenham, TX Urban Cluster (2010)",15663,261
400C100US10000,10000,"Brent, AL Urban Cluster (2010)",4691,543
400C100US10027,10027,"Brevard, NC Urban Cluster (2010)",13198,675
400C100US10081,10081,"Brewton, AL Urban Cluster (2010)",6865,430
400C100US10135,10135,"Bridgeport, TX Urban Cluster (2010)",5441,325
400C100US10162,10162,"Bridgeport--Stamford, CT--NY Urbanized Area (2010)",922358,1576
400C100US10189,10189,"Bridgeton, NJ Urban Cluster (2010)",35146,513
400C100US10198,10198,"Bridgeville, DE Urban Cluster (2010)",3398,571
400C100US10297,10297,"Brillion, WI Urban Cluster (2010)",3054,73
400C100US10324,10324,"Brinkley, AR Urban Cluster (2010)",2603,165
400C100US10351,10351,"Bristol--Bristol, TN--VA Urbanized Area (2010)",68213,1176
400C100US10378,10378,"Bristow, OK Urban Cluster (2010)",4123,119
400C100US10405,10405,"Broadway, VA Urban Cluster (2010)",6279,126
400C100US10418,10418,"Brockport, NY Urban Cluster (2010)",20205,678
400C100US10426,10426,"Brockway, PA Urban Cluster (2010)",2872,175
