400C100US72910,72910,"Quarryville, PA Urban Cluster (2010)",7256,482
400C100US72937,72937,"Quartzsite, AZ Urban Cluster (2010)",3340,206
400C100US73018,73018,"Quincy, FL Urban Cluster (2010)",10161,784
400C100US73045,73045,"Quincy, IL Urban Cluster (2010)",45417,491
400C100US73072,73072,"Quincy, WA Urban Cluster (2010)",7083,298
400C100US73126,73126,"Quitman, GA Urban Cluster (2010)",3679,194
400C100US73136,73136,"Quitman, TX Urban Cluster (2010)",3038,381
400C100US73153,73153,"Racine, WI Urbanized Area (2010)",133616,579
400C100US73245,73245,"Rainbow Lakes Estates, FL Urban Cluster (2010)",5867,711
400C100US73261,73261,"Raleigh, NC Urbanized Area (2010)",889134,2929
400C100US73288,73288,"Ramona, CA Urban Cluster (2010)",27466,1305
400C100US73300,73300,"Ramseur, NC Urban Cluster (2010)",3007,472
400C100US73315,73315,"Rancho Calaveras--Valley Springs, CA Urban Cluster (2010)",9381,742
400C100US73342,73342,"Rancho Murieta, CA Urban Cluster (2010)",6037,416
400C100US73369,73369,"Rantoul, IL Urban Cluster (2010)",13966,218
400C100US73396,73396,"Rapid City, SD Urbanized Area (2010)",80818,899
400C100US73423,73423,"Rathdrum, ID Urban Cluster (2010)",6682,116
400C100US73450,73450,"Raton, NM Urban Cluster (2010)",6556,119
400C100US73477,73477,"Ravena, NY Urban Cluster (2010)",5221,437
400C100US73504,73504,"Ravenswood, WV Urban Cluster (2010)",3954,342
400C100US73531,73531,"Rawlins, WY Urban Cluster (2010)",8559,333
400C100US73554,73554,"Raymond, MS Urban Cluster (2010)",2834,475
400C100US73585,73585,"Raymond, WA Urban Cluster (2010)",4067,278
400C100US73612,73612,"Raymondville, TX Urban Cluster (2010)",14732,401
400C100US73639,73639,"Rayne, LA Urban Cluster (2010)",9551,543
400C100US73666,73666,"Rayville, LA Urban Cluster (2010)",3848,223
400C100US73693,73693,"Reading, PA Urbanized Area (2010)",265995,1333
400C100US73720,73720,"Red Bluff, CA Urban Cluster (2010)",18671,662
400C100US73747,73747,"Red Bud, IL Urban Cluster (2010)",3659,28
400C100US73774,73774,"Redding, CA Urbanized Area (2010)",117588,940
400C100US73828,73828,"Red Hook, NY Urban Cluster (2010)",6610,416
400C100US73882,73882,"Redmond, OR Urban Cluster (2010)",28205,668
400C100US73909,73909,"Red Oak, IA Urban Cluster (2010)",5377,153
400C100US73936,73936,"Red Springs, NC Urban Cluster (2010)",3719,251
400C100US73963,73963,"Red Wing, MN Urban Cluster (2010)",14680,287
400C100US73990,73990,"Redwood Falls, MN Urban Cluster (2010)",4903,112
400C100US74044,74044,"Reedley--Dinuba, CA Urban Cluster (2010)",46747,639
400C100US74071,74071,"Reedsburg, WI Urban Cluster (2010)",9193,129
400C100US74098,74098,"Reedsport, OR Urban Cluster (2010)",4364,198
400C100US74125,74125,"Refugio, TX Urban Cluster (2010)",2877,18
400C100US74142,74142,"Reidsville, GA Urban Cluster (2010)",4145,582
400C100US74152,74152,"Reidsville, NC Urban Cluster (2010)",13787,301
400C100US74179,74179,"Reno, NV--CA Urbanized Area (2010)",393429,1298
400C100US74206,74206,"Rensselaer, IN Urban Cluster (2010)",6113,332
400C100US74260,74260,"Rexburg, ID Urban Cluster (2010)",26507,317
400C100US74287,74287,"Reynoldsville, PA Urban Cluster (2010)",2790,34
400C100US74314,74314,"Rhinebeck, NY Urban Cluster (2010)",3068,124
400C100US74341,74341,"Rhinelander, WI Urban Cluster (2010)",8987,278
400C100US74368,74368,"Rice Lake, WI Urban Cluster (2010)",9276,303
400C100US74395,74395,"Richfield, UT Urban Cluster (2010)",7207,181
400C100US74449,74449,"Richgrove, CA Urban Cluster (2010)",2895,413
400C100US74557,74557,"Richland Center, WI Urban Cluster (2010)",4993,88
400C100US74584,74584,"Richlands, VA Urban Cluster (2010)",9883,467
400C100US74601,74601,"Richlands South, NC Urban Cluster (2010)",4625,575
400C100US74638,74638,"Richmond, IN--OH Urban Cluster (2010)",44236,374
400C100US74665,74665,"Richmond, KY Urban Cluster (2010)",36001,728
400C100US74692,74692,"Richmond, MI Urban Cluster (2010)",6132,145
400C100US74719,74719,"Richmond, MO Urban Cluster (2010)",5370,333
400C100US74746,74746,"Richmond, VA Urbanized Area (2010)",952592,1940
400C100US74827,74827,"Ridgecrest, CA Urban Cluster (2010)",30570,476
400C100US74840,74840,"Ridgefield, WA Urban Cluster (2010)",4187,228
400C100US74854,74854,"Ridgeland, SC Urban Cluster (2010)",5630,1054
400C100US74881,74881,"Ridge Manor, FL Urban Cluster (2010)",3013,470
400C100US74908,74908,"Ridgway, PA Urban Cluster (2010)",4412,115
400C100US74935,74935,"Rifle, CO Urban Cluster (2010)",10010,478
400C100US74962,74962,"Rigby, ID Urban Cluster (2010)",8171,573
400C100US74989,74989,"Rincon, GA Urban Cluster (2010)",12682,1043
400C100US75016,75016,"Rio Bravo--El Cenizo, TX Urban Cluster (2010)",8171,29
400C100US75043,75043,"Rio Dell, CA Urban Cluster (2010)",3971,276
400C100US75072,75072,"Rio Grande City--Roma, TX Urban Cluster (2010)",46624,1173
400C100US75080,75080,"Rio Hondo, TX Urban Cluster (2010)",4344,550
400C100US75089,75089,"Rio Rico Northeast, AZ Urban Cluster (2010)",3513,737
400C100US75097,75097,"Rio Vista, CA Urban Cluster (2010)",6885,166
400C100US75124,75124,"Ripley, MS Urban Cluster (2010)",3752,415
400C100US75151,75151,"Ripley, TN Urban Cluster (2010)",8579,361
400C100US75178,75178,"Ripley, WV Urban Cluster (2010)",3795,335
400C100US75205,75205,"Ripon, WI Urban Cluster (2010)",8067,152
400C100US75270,75270,"Riverdale, CA Urban Cluster (2010)",3313,711
400C100US75286,75286,"River Falls, WI Urban Cluster (2010)",15304,136
400C100US75340,75340,"Riverside--San Bernardino, CA Urbanized Area (2010)",1953474,5002
400C100US75367,75367,"Riverton, WY Urban Cluster (2010)",12382,513
400C100US75394,75394,"Roanoke, AL Urban Cluster (2010)",3975,394
400C100US75421,75421,"Roanoke, VA Urbanized Area (2010)",211071,1246
400C100US75448,75448,"Roanoke Rapids, NC Urban Cluster (2010)",24524,831
400C100US75475,75475,"Roaring Spring, PA Urban Cluster (2010)",6311,394
400C100US75502,75502,"Robertsdale, AL Urban Cluster (2010)",7482,514
400C100US75529,75529,"Robinson, IL Urban Cluster (2010)",7749,233
400C100US75556,75556,"Robstown, TX Urban Cluster (2010)",12768,606
400C100US75583,75583,"Rochelle, IL Urban Cluster (2010)",10982,291
400C100US75610,75610,"Rochester, IN Urban Cluster (2010)",7180,292
400C100US75637,75637,"Rochester, MN Urbanized Area (2010)",108000,301
400C100US75664,75664,"Rochester, NY Urbanized Area (2010)",720938,1458
400C100US75691,75691,"Rockdale, TX Urban Cluster (2010)",5265,235
400C100US75718,75718,"Rockford, IL Urbanized Area (2010)",296480,1337
400C100US75732,75732,"Rockford, MN Urban Cluster (2010)",4464,220
400C100US75745,75745,"Rock Hill, SC Urbanized Area (2010)",105830,1371
400C100US75772,75772,"Rockingham--Hamlet, NC Urban Cluster (2010)",24089,773
400C100US75799,75799,"Rockland, ME Urban Cluster (2010)",9134,294
400C100US75826,75826,"Rockmart, GA Urban Cluster (2010)",7140,643
400C100US75853,75853,"Rockport, TX Urban Cluster (2010)",16633,761
400C100US75880,75880,"Rock Springs, WY Urban Cluster (2010)",26439,519
400C100US75907,75907,"Rock Valley, IA Urban Cluster (2010)",2765,261
400C100US75934,75934,"Rockville, IN Urban Cluster (2010)",3553,240
400C100US75961,75961,"Rocky Ford, CO Urban Cluster (2010)",4244,203
400C100US75988,75988,"Rocky Mount, NC Urbanized Area (2010)",66437,955
400C100US76015,76015,"Rocky Mount, VA Urban Cluster (2010)",5749,505
400C100US76042,76042,"Rogers City, MI Urban Cluster (2010)",2454,141
400C100US76059,76059,"Rogersville, MO Urban Cluster (2010)",3112,249
400C100US76069,76069,"Rogersville, TN Urban Cluster (2010)",6690,577
400C100US76123,76123,"Rolla, MO Urban Cluster (2010)",19623,389
400C100US76177,76177,"Romancoke, MD Urban Cluster (2010)",3326,484
400C100US76204,76204,"Rome, GA Urbanized Area (2010)",60780,1498
400C100US76231,76231,"Rome, NY Urban Cluster (2010)",33027,551
400C100US76258,76258,"Roosevelt, UT Urban Cluster (2010)",5746,107
400C100US76285,76285,"Rosamond, CA Urban Cluster (2010)",15894,1245
400C100US76312,76312,"Roseau, MN Urban Cluster (2010)",2719,66
400C100US76339,76339,"Roseburg, OR Urban Cluster (2010)",42967,964
400C100US76366,76366,"Rose Hill, KS Urban Cluster (2010)",3978,244
400C100US76447,76447,"Roswell, NM Urban Cluster (2010)",49716,624
400C100US76474,76474,"Round Lake Beach--McHenry--Grayslake, IL--WI Urbanized Area (2010)",286652,1545
400C100US76501,76501,"Roxboro, NC Urban Cluster (2010)",9350,419
400C100US76528,76528,"Roxborough Park, CO Urban Cluster (2010)",8530,532
400C100US76582,76582,"Royston, GA Urban Cluster (2010)",3028,416
400C100US76595,76595,"Ruckersville, VA Urban Cluster (2010)",5290,641
400C100US76609,76609,"Rugby, ND Urban Cluster (2010)",2837,211
400C100US76636,76636,"Ruidoso, NM Urban Cluster (2010)",9782,425
400C100US76663,76663,"Ruleville, MS Urban Cluster (2010)",2915,79
400C100US76690,76690,"Rumford, ME Urban Cluster (2010)",5226,382
400C100US76717,76717,"Running Springs, CA Urban Cluster (2010)",4953,728
400C100US76744,76744,"Rupert, ID Urban Cluster (2010)",6497,462
400C100US76759,76759,"Rush City, MN Urban Cluster (2010)",2866,100
400C100US76771,76771,"Rushville, IL Urban Cluster (2010)",3226,234
400C100US76798,76798,"Rushville, IN Urban Cluster (2010)",6578,253
400C100US76825,76825,"Rusk, TX Urban Cluster (2010)",3627,359
400C100US76852,76852,"Russell, KS Urban Cluster (2010)",4134,214
400C100US76879,76879,"Russells Point, OH Urban Cluster (2010)",6445,331
400C100US76906,76906,"Russellville, AL Urban Cluster (2010)",9751,582
400C100US76933,76933,"Russellville, AR Urban Cluster (2010)",32514,575
400C100US76960,76960,"Russellville, KY Urban Cluster (2010)",6686,386
400C100US76987,76987,"Ruston, LA Urban Cluster (2010)",27840,544
400C100US77014,77014,"Rutland, VT Urban Cluster (2010)",19721,340
400C100US77027,77027,"Sabetha, KS Urban Cluster (2010)",2435,73
400C100US77041,77041,"Sabina, OH Urban Cluster (2010)",2622,304
400C100US77068,77068,"Sacramento, CA Urbanized Area (2010)",1729441,2799
400C100US77095,77095,"Safford, AZ Urban Cluster (2010)",19177,538
400C100US77149,77149,"Saginaw, MI Urbanized Area (2010)",125039,639
400C100US77161,77161,"Sahuarita--Green Valley, AZ Urban Cluster (2010)",40072,1267
400C100US77176,77176,"St. Albans, VT Urban Cluster (2010)",9054,381
400C100US77203,77203,"St. Anthony, ID Urban Cluster (2010)",3761,152
400C100US77230,77230,"St. Augustine, FL Urbanized Area (2010)",72219,1606
400C100US77284,77284,"St. Charles, MN Urban Cluster (2010)",3051,157
400C100US77311,77311,"St. Clair, MO Urban Cluster (2010)",5728,322
400C100US77338,77338,"St. Cloud, MN Urbanized Area (2010)",109310,1233
400C100US77365,77365,"Ste. Genevieve, MO Urban Cluster (2010)",4443,142
400C100US77392,77392,"St. Francis, MN Urban Cluster (2010)",6062,376
400C100US77446,77446,"St. George, UT Urbanized Area (2010)",100658,826
400C100US77500,77500,"St. Helena, CA Urban Cluster (2010)",7188,528
400C100US77527,77527,"St. Helens, OR Urban Cluster (2010)",25656,617
400C100US77554,77554,"St. Ignace, MI Urban Cluster (2010)",2805,230
400C100US77581,77581,"St. James, MN Urban Cluster (2010)",4588,37
400C100US77608,77608,"St. James, MO Urban Cluster (2010)",3919,157
400C100US77618,77618,"St. James, NC Urban Cluster (2010)",2372,343
400C100US77635,77635,"St. Johns, AZ Urban Cluster (2010)",2554,296
400C100US77662,77662,"St. Johns, MI Urban Cluster (2010)",8479,179
400C100US77689,77689,"St. Johnsbury, VT Urban Cluster (2010)",5127,324
400C100US77716,77716,"St. Joseph, IL Urban Cluster (2010)",4860,275
400C100US77743,77743,"St. Joseph, MO--KS Urbanized Area (2010)",81370,453
400C100US77770,77770,"St. Louis, MO--IL Urbanized Area (2010)",2149655,1916
400C100US77797,77797,"St. Maries, ID Urban Cluster (2010)",2718,364
400C100US77824,77824,"St. Martinville, LA Urban Cluster (2010)",7933,448
400C100US77841,77841,"St. Marys, KS Urban Cluster (2010)",2892,177
400C100US77851,77851,"St. Marys, OH Urban Cluster (2010)",8687,282
400C100US77878,77878,"St. Marys, PA Urban Cluster (2010)",9398,484
400C100US77905,77905,"St. Marys, WV--OH Urban Cluster (2010)",4414,405
400C100US77932,77932,"St. Marys--Kingsland, GA Urban Cluster (2010)",33554,819
400C100US77986,77986,"St. Pauls, NC Urban Cluster (2010)",3012,424
400C100US78013,78013,"St. Peter, MN Urban Cluster (2010)",11835,242
400C100US78026,78026,"St. Simons, GA Urban Cluster (2010)",12187,686
400C100US78067,78067,"Salamanca, NY Urban Cluster (2010)",5897,258
400C100US78094,78094,"Salem, IL Urban Cluster (2010)",8413,312
400C100US78121,78121,"Salem, IN Urban Cluster (2010)",6526,126
400C100US78148,78148,"Salem, MO Urban Cluster (2010)",4840,95
400C100US78175,78175,"Salem, NJ Urban Cluster (2010)",5753,92
400C100US78202,78202,"Salem, OH Urban Cluster (2010)",18633,366
400C100US78229,78229,"Salem, OR Urbanized Area (2010)",236092,1422
400C100US78256,78256,"Salida, CO Urban Cluster (2010)",7564,371
400C100US78283,78283,"Salina, KS Urban Cluster (2010)",47400,154
400C100US78310,78310,"Salinas, CA Urbanized Area (2010)",185990,1399
400C100US78364,78364,"Salisbury, MD--DE Urbanized Area (2010)",96810,1368
400C100US78418,78418,"Sallisaw, OK Urban Cluster (2010)",8075,222
400C100US78445,78445,"Salmon, ID Urban Cluster (2010)",2959,121
400C100US78472,78472,"Saltillo, MS Urban Cluster (2010)",4385,257
400C100US78499,78499,"Salt Lake City--West Valley City, UT Urbanized Area (2010)",1023204,1115
400C100US78526,78526,"Saluda, SC Urban Cluster (2010)",3230,259
400C100US78553,78553,"San Angelo, TX Urbanized Area (2010)",92648,574
400C100US78580,78580,"San Antonio, TX Urbanized Area (2010)",1762869,3130
400C100US78607,78607,"San Carlos, AZ Urban Cluster (2010)",4430,745
400C100US78634,78634,"Sandersville, GA Urban Cluster (2010)",7289,457
400C100US78661,78661,"San Diego, CA Urbanized Area (2010)",2962993,3716
400C100US78688,78688,"San Diego, TX Urban Cluster (2010)",4753,489
400C100US78715,78715,"Sandpoint, ID Urban Cluster (2010)",10994,528
400C100US78742,78742,"Sandusky, MI Urban Cluster (2010)",2815,64
400C100US78769,78769,"Sandusky, OH Urban Cluster (2010)",49186,478
400C100US78823,78823,"Sandy, OR Urban Cluster (2010)",9615,250
400C100US78850,78850,"Sanford, ME Urban Cluster (2010)",14064,590
400C100US78877,78877,"Sanford, NC Urban Cluster (2010)",33331,1052
400C100US78904,78904,"San Francisco--Oakland, CA Urbanized Area (2010)",3296052,1925
400C100US78931,78931,"Sanger, CA Urban Cluster (2010)",26358,632
400C100US78958,78958,"Sanger, TX Urban Cluster (2010)",5515,498
400C100US79012,79012,"San Joaquin, CA Urban Cluster (2010)",3961,28
400C100US79039,79039,"San Jose, CA Urbanized Area (2010)",1670172,1350
400C100US79120,79120,"San Luis, AZ Urban Cluster (2010)",22729,737
400C100US79147,79147,"San Luis Obispo, CA Urbanized Area (2010)",57405,786
400C100US79174,79174,"San Manuel, AZ Urban Cluster (2010)",3350,505
400C100US79201,79201,"San Marcos, TX Urbanized Area (2010)",52915,1422
400C100US79255,79255,"San Saba, TX Urban Cluster (2010)",2904,123
400C100US79282,79282,"Santa Barbara, CA Urbanized Area (2010)",197252,1410
400C100US79309,79309,"Santa Clarita, CA Urbanized Area (2010)",259567,1848
400C100US79336,79336,"Santa Cruz, CA Urbanized Area (2010)",163017,1281
400C100US79363,79363,"Santa Fe, NM Urbanized Area (2010)",88823,936
400C100US79417,79417,"Santa Maria, CA Urbanized Area (2010)",129807,1120
400C100US79444,79444,"Santa Paula, CA Urban Cluster (2010)",29860,182
400C100US79471,79471,"Santaquin, UT Urban Cluster (2010)",10011,220
400C100US79498,79498,"Santa Rosa, CA Urbanized Area (2010)",305973,1935
400C100US79525,79525,"Santa Rosa, NM Urban Cluster (2010)",2681,320
400C100US79537,79537,"Santa Rosa Beach, FL Urban Cluster (2010)",3925,703
400C100US79552,79552,"Santo Domingo Pueblo, NM Urban Cluster (2010)",2357,323
400C100US79579,79579,"Saranac Lake, NY Urban Cluster (2010)",8297,518
400C100US79606,79606,"Sarasota--Bradenton, FL Urbanized Area (2010)",649044,1762
400C100US79633,79633,"Saratoga Springs, NY Urbanized Area (2010)",63772,1145
400C100US79687,79687,"Sauk Centre, MN Urban Cluster (2010)",4336,71
400C100US79714,79714,"Sault Ste. Marie, MI Urban Cluster (2010)",12933,310
400C100US79741,79741,"Savanna, IL--IA Urban Cluster (2010)",3117,253
400C100US79768,79768,"Savannah, GA Urbanized Area (2010)",262496,1254
400C100US79795,79795,"Savannah, MO Urban Cluster (2010)",5069,45
400C100US79822,79822,"Savannah, TN Urban Cluster (2010)",8208,292
400C100US79834,79834,"Saw Creek, PA Urban Cluster (2010)",6580,977
400C100US79876,79876,"Sayre, OK Urban Cluster (2010)",3308,349
400C100US79903,79903,"Sayre--Waverly, PA--NY Urban Cluster (2010)",18293,488
400C100US79930,79930,"Schulenburg, TX Urban Cluster (2010)",2691,120
400C100US79957,79957,"Schuyler, NE Urban Cluster (2010)",6105,85
400C100US80011,80011,"Scott City, KS Urban Cluster (2010)",3887,273
400C100US80038,80038,"Scott City, MO Urban Cluster (2010)",5027,136
400C100US80065,80065,"Scottsbluff, NE Urban Cluster (2010)",25312,340
400C100US80092,80092,"Scottsboro, AL Urban Cluster (2010)",9499,625
400C100US80119,80119,"Scottsburg, IN Urban Cluster (2010)",11148,369
400C100US80173,80173,"Scottsville, KY Urban Cluster (2010)",4506,223
400C100US80227,80227,"Scranton, PA Urbanized Area (2010)",379424,1109
400C100US80281,80281,"Sealy, TX Urban Cluster (2010)",5434,267
400C100US80308,80308,"Searcy, AR Urban Cluster (2010)",26587,704
400C100US80335,80335,"Seaside, OR Urban Cluster (2010)",8255,345
400C100US80362,80362,"Seaside--Monterey, CA Urbanized Area (2010)",116076,773
400C100US80389,80389,"Seattle, WA Urbanized Area (2010)",3075787,3260
400C100US80400,80400,"Sebastian--Vero Beach South--Florida Ridge, FL Urbanized Area (2010)",148333,1221
400C100US80416,80416,"Sebring--Avon Park, FL Urbanized Area (2010)",61074,1491
400C100US80443,80443,"Sedalia, MO Urban Cluster (2010)",26540,525
400C100US80470,80470,"Sedona, AZ Urban Cluster (2010)",6373,866
400C100US80497,80497,"Seguin, TX Urban Cluster (2010)",24753,570
400C100US80524,80524,"Selma, AL Urban Cluster (2010)",23429,694
400C100US80551,80551,"Selma, CA Urban Cluster (2010)",42388,687
400C100US80578,80578,"Selmer, TN Urban Cluster (2010)",3912,364
400C100US80605,80605,"Seminole, OK Urban Cluster (2010)",5926,266
400C100US80632,80632,"Seminole, TX Urban Cluster (2010)",6765,243
400C100US80659,80659,"Senatobia, MS Urban Cluster (2010)",6294,462
400C100US80671,80671,"Seneca, SC Urban Cluster (2010)",25730,996
400C100US80686,80686,"Sequim, WA Urban Cluster (2010)",19382,664
400C100US80695,80695,"Seven Lakes, NC Urban Cluster (2010)",3571,473
400C100US80704,80704,"Severance, CO Urban Cluster (2010)",2573,147
400C100US80713,80713,"Sevierville, TN Urban Cluster (2010)",23248,879
400C100US80740,80740,"Seville, OH Urban Cluster (2010)",7555,467
400C100US80767,80767,"Seward, NE Urban Cluster (2010)",6701,92
400C100US80794,80794,"Seymour, IN Urban Cluster (2010)",21287,506
400C100US80848,80848,"Seymour (Outagamie County), WI Urban Cluster (2010)",3547,45
400C100US80875,80875,"Shady Cove, OR Urban Cluster (2010)",3061,131
400C100US80902,80902,"Shady Side--Deale, MD Urban Cluster (2010)",11135,585
400C100US80929,80929,"Shafter, CA Urban Cluster (2010)",17643,449
400C100US80956,80956,"Shallowater, TX Urban Cluster (2010)",3274,260
400C100US80985,80985,"Shamokin--Mount Carmel, PA Urban Cluster (2010)",30125,415
400C100US81002,81002,"Shannondale, WV Urban Cluster (2010)",2365,327
400C100US81064,81064,"Shawano, WI Urban Cluster (2010)",10514,266
400C100US81091,81091,"Shawnee, OK Urban Cluster (2010)",34247,654
400C100US81118,81118,"Sheboygan, WI Urbanized Area (2010)",71856,391
400C100US81172,81172,"Shelby, MT Urban Cluster (2010)",2501,273
400C100US81199,81199,"Shelby, NC Urban Cluster (2010)",27055,938
400C100US81226,81226,"Shelby, OH Urban Cluster (2010)",9200,342
400C100US81253,81253,"Shelbyville, IL Urban Cluster (2010)",5464,397
400C100US81280,81280,"Shelbyville, IN Urban Cluster (2010)",20550,501
400C100US81307,81307,"Shelbyville, KY Urban Cluster (2010)",21240,668
400C100US81334,81334,"Shelbyville, TN Urban Cluster (2010)",20015,394
400C100US81361,81361,"Sheldon, IA Urban Cluster (2010)",4813,161
400C100US81388,81388,"Shelley, ID Urban Cluster (2010)",4568,125
400C100US81415,81415,"Shelton, WA Urban Cluster (2010)",18092,637
400C100US81442,81442,"Shenandoah, IA Urban Cluster (2010)",5181,139
400C100US81472,81472,"Shenandoah--Mahanoy City--Frackville, PA Urban Cluster (2010)",18624,430
400C100US81496,81496,"Shepherdstown, WV--MD Urban Cluster (2010)",4135,424
400C100US81523,81523,"Sheridan, AR Urban Cluster (2010)",3868,372
400C100US81550,81550,"Sheridan, IN Urban Cluster (2010)",2618,317
400C100US81577,81577,"Sheridan, OR Urban Cluster (2010)",7873,272
400C100US81604,81604,"Sheridan, WY Urban Cluster (2010)",18618,335
400C100US81631,81631,"Sherman, TX Urbanized Area (2010)",62200,590
400C100US81658,81658,"Shippensburg, PA Urban Cluster (2010)",17269,693
400C100US81685,81685,"Shiprock, NM Urban Cluster (2010)",7466,1011
400C100US81701,81701,"Shorewood Forest, IN Urban Cluster (2010)",3181,421
400C100US81712,81712,"Show Low, AZ Urban Cluster (2010)",10296,745
400C100US81739,81739,"Shreveport, LA Urbanized Area (2010)",298190,1547
400C100US81766,81766,"Sibley, IA Urban Cluster (2010)",2620,73
400C100US81793,81793,"Sidney, MT Urban Cluster (2010)",5557,119
400C100US81820,81820,"Sidney, NE Urban Cluster (2010)",6374,178
400C100US81847,81847,"Sidney, NY Urban Cluster (2010)",5494,496
400C100US81874,81874,"Sidney, OH Urban Cluster (2010)",21909,577
400C100US81889,81889,"Sierra View--Indian Mountain Lake, PA Urban Cluster (2010)",27978,1294
400C100US81901,81901,"Sierra Vista, AZ Urbanized Area (2010)",51823,901
400C100US81928,81928,"Sikeston, MO Urban Cluster (2010)",16501,333
400C100US81955,81955,"Siler City, NC Urban Cluster (2010)",9187,524
400C100US81982,81982,"Siloam Springs, AR--OK Urban Cluster (2010)",18911,366
400C100US82009,82009,"Silsbee, TX Urban Cluster (2010)",9843,579
400C100US82023,82023,"Silt, CO Urban Cluster (2010)",2884,76
400C100US82036,82036,"Silver City, NM Urban Cluster (2010)",12265,674
400C100US82063,82063,"Silver Creek, NY Urban Cluster (2010)",3813,188
400C100US82076,82076,"Silver Lakes, CA Urban Cluster (2010)",5153,542
400C100US82090,82090,"Silverthorne--Frisco, CO Urban Cluster (2010)",16129,841
400C100US82117,82117,"Silverton, OR Urban Cluster (2010)",9805,315
400C100US82144,82144,"Simi Valley, CA Urbanized Area (2010)",125301,788
400C100US82171,82171,"Sinton, TX Urban Cluster (2010)",5819,421
400C100US82198,82198,"Sioux Center, IA Urban Cluster (2010)",6671,160
400C100US82225,82225,"Sioux City, IA--NE--SD Urbanized Area (2010)",106279,695
400C100US82252,82252,"Sioux Falls, SD Urbanized Area (2010)",157455,572
400C100US82279,82279,"Sissonville, WV Urban Cluster (2010)",3666,702
400C100US82306,82306,"Sitka, AK Urban Cluster (2010)",7002,328
400C100US82333,82333,"Skaneateles, NY Urban Cluster (2010)",3654,313
400C100US82360,82360,"Skiatook, OK Urban Cluster (2010)",6958,422
400C100US82387,82387,"Skowhegan, ME Urban Cluster (2010)",5082,521
400C100US82414,82414,"Slaton, TX Urban Cluster (2010)",5853,140
400C100US82441,82441,"Sleepy Eye, MN Urban Cluster (2010)",3499,47
400C100US82468,82468,"Slidell, LA Urbanized Area (2010)",91394,2086
400C100US82495,82495,"Slippery Rock, PA Urban Cluster (2010)",6280,390
400C100US82522,82522,"Smithfield, NC Urban Cluster (2010)",26808,1201
400C100US82549,82549,"Smithfield, VA Urban Cluster (2010)",10727,543
400C100US82562,82562,"Smithton, IL Urban Cluster (2010)",3554,325
400C100US82603,82603,"Smithville, TN Urban Cluster (2010)",4067,238
400C100US82630,82630,"Smithville, TX Urban Cluster (2010)",3621,240
400C100US82641,82641,"Smithville North, MO Urban Cluster (2010)",2803,279
400C100US82665,82665,"Sneads Ferry, NC Urban Cluster (2010)",3702,484
400C100US82675,82675,"Snoqualmie, WA Urban Cluster (2010)",20540,578
400C100US82684,82684,"Snowflake, AZ Urban Cluster (2010)",6748,659
400C100US82711,82711,"Snyder, TX Urban Cluster (2010)",11360,281
400C100US82724,82724,"Social Circle, GA Urban Cluster (2010)",3666,202
400C100US82738,82738,"Socorro, NM Urban Cluster (2010)",9050,325
400C100US82765,82765,"Soda Springs, ID Urban Cluster (2010)",2802,142
400C100US82792,82792,"Sodus, NY Urban Cluster (2010)",3112,387
400C100US82819,82819,"Soldotna, AK Urban Cluster (2010)",7010,567
400C100US82846,82846,"Soledad, CA Urban Cluster (2010)",25978,131
400C100US82873,82873,"Solvang--Buellton--Santa Ynez, CA Urban Cluster (2010)",15254,520
400C100US82900,82900,"Somerset, KY Urban Cluster (2010)",29329,1051
400C100US82913,82913,"Somerset, MI Urban Cluster (2010)",3051,336
400C100US82927,82927,"Somerset, PA Urban Cluster (2010)",11977,377
400C100US82937,82937,"Somerset, WI Urban Cluster (2010)",2574,135
400C100US82981,82981,"Somerton, AZ Urban Cluster (2010)",16407,667
400C100US83008,83008,"Sonoma, CA Urban Cluster (2010)",34640,1280
400C100US83062,83062,"Sonora, TX Urban Cluster (2010)",3409,236
400C100US83073,83073,"Sonora--Jamestown--Phoenix Lake, CA Urban Cluster (2010)",28199,1104
400C100US83089,83089,"Soperton, GA Urban Cluster (2010)",2778,260
400C100US83116,83116,"South Bend, IN--MI Urbanized Area (2010)",278613,1080
400C100US83143,83143,"South Boston, VA Urban Cluster (2010)",8032,378
400C100US83156,83156,"South Deerfield, MA Urban Cluster (2010)",5432,481
400C100US83210,83210,"South Fallsburg, NY Urban Cluster (2010)",3397,485
400C100US83251,83251,"South Haven, MI Urban Cluster (2010)",5803,308
400C100US83278,83278,"South Hill, VA Urban Cluster (2010)",4753,550
400C100US83305,83305,"South Lake Tahoe, CA--NV Urban Cluster (2010)",28372,725
400C100US83332,83332,"South Lyon--Howell, MI Urbanized Area (2010)",120233,1101
400C100US83359,83359,"Southold, NY Urban Cluster (2010)",10099,595
400C100US83368,83368,"South Paris, ME Urban Cluster (2010)",4801,516
400C100US83377,83377,"South Pittsburg, TN--AL Urban Cluster (2010)",5060,310
400C100US83386,83386,"South Vacherie, LA Urban Cluster (2010)",2735,347
400C100US83440,83440,"Sparta, GA Urban Cluster (2010)",3538,440
400C100US83467,83467,"Sparta, IL Urban Cluster (2010)",4020,142
400C100US83480,83480,"Sparta, MI Urban Cluster (2010)",4137,61
