400C100US21205,21205,"Crockett, TX Urban Cluster (2010)",6518,125
400C100US21220,21220,"Crooked Lake Park, FL Urban Cluster (2010)",3814,396
400C100US21232,21232,"Crookston, MN Urban Cluster (2010)",7679,164
400C100US21259,21259,"Crooksville, OH Urban Cluster (2010)",4882,336
400C100US21286,21286,"Crosby, MN Urban Cluster (2010)",3302,306
400C100US21313,21313,"Cross City, FL Urban Cluster (2010)",3686,517
400C100US21340,21340,"Crossett, AR Urban Cluster (2010)",7961,339
400C100US21394,21394,"Crossville, TN Urban Cluster (2010)",16796,840
400C100US21421,21421,"Crowley, LA Urban Cluster (2010)",14806,488
400C100US21448,21448,"Crozet, VA Urban Cluster (2010)",5783,497
400C100US21502,21502,"Crystal City, TX Urban Cluster (2010)",7188,66
400C100US21529,21529,"Crystal River, FL Urban Cluster (2010)",4982,624
400C100US21556,21556,"Crystal Springs, MS Urban Cluster (2010)",5331,370
400C100US21583,21583,"Cuba, MO Urban Cluster (2010)",2983,317
400C100US21610,21610,"Cuero, TX Urban Cluster (2010)",7137,306
400C100US21637,21637,"Cullman, AL Urban Cluster (2010)",18533,672
400C100US21664,21664,"Cullowhee, NC Urban Cluster (2010)",9538,760
400C100US21691,21691,"Culpeper, VA Urban Cluster (2010)",17932,450
400C100US21718,21718,"Cumberland, KY Urban Cluster (2010)",4234,472
400C100US21745,21745,"Cumberland, MD--WV--PA Urbanized Area (2010)",51662,905
400C100US21760,21760,"Curwensville, PA Urban Cluster (2010)",2670,110
400C100US21772,21772,"Cushing, OK Urban Cluster (2010)",6967,236
400C100US21799,21799,"Cut Bank, MT Urban Cluster (2010)",2896,13
400C100US21826,21826,"Cuthbert, GA Urban Cluster (2010)",3722,116
400C100US21853,21853,"Cynthiana, KY Urban Cluster (2010)",6338,58
400C100US21928,21928,"Dahlgren, VA--MD Urban Cluster (2010)",3903,538
400C100US21934,21934,"Dahlonega, GA Urban Cluster (2010)",4440,394
400C100US21961,21961,"Daingerfield, TX Urban Cluster (2010)",5061,371
400C100US21988,21988,"Dalhart, TX Urban Cluster (2010)",7749,226
400C100US22015,22015,"Dallas, OR Urban Cluster (2010)",15039,184
400C100US22042,22042,"Dallas--Fort Worth--Arlington, TX Urbanized Area (2010)",5142626,3786
400C100US22069,22069,"Dalton, GA Urbanized Area (2010)",85040,1698
400C100US22079,22079,"Dalton, OH Urban Cluster (2010)",2692,381
400C100US22096,22096,"Danbury, CT--NY Urbanized Area (2010)",169067,1200
400C100US22110,22110,"Dandridge, TN Urban Cluster (2010)",4937,522
400C100US22177,22177,"Dansville, NY Urban Cluster (2010)",5166,123
400C100US22204,22204,"Danville, IL Urbanized Area (2010)",50438,521
400C100US22231,22231,"Danville, KY Urban Cluster (2010)",19033,414
400C100US22253,22253,"Danville, VA--NC Urban Cluster (2010)",50341,691
400C100US22285,22285,"Daphne--Fairhope, AL Urbanized Area (2010)",60575,1376
400C100US22301,22301,"Darbydale, OH Urban Cluster (2010)",4915,455
400C100US22312,22312,"Darien, GA Urban Cluster (2010)",4317,814
400C100US22366,22366,"Davenport, IA--IL Urbanized Area (2010)",280503,888
400C100US22393,22393,"David City, NE Urban Cluster (2010)",2876,29
400C100US22420,22420,"Davis, CA Urbanized Area (2010)",74231,631
400C100US22427,22427,"Davis, OK Urban Cluster (2010)",2598,92
400C100US22435,22435,"Davis Junction, IL Urban Cluster (2010)",3010,224
400C100US22447,22447,"Dawson, GA Urban Cluster (2010)",4482,166
400C100US22501,22501,"Dayton, NV Urban Cluster (2010)",10540,844
400C100US22528,22528,"Dayton, OH Urbanized Area (2010)",724385,1443
400C100US22555,22555,"Dayton, TN Urban Cluster (2010)",10365,699
400C100US22582,22582,"Dayton, TX Urban Cluster (2010)",10464,1611
400C100US22609,22609,"Dayton, WA Urban Cluster (2010)",2913,160
400C100US22690,22690,"Decatur, AL Urbanized Area (2010)",69084,813
400C100US22717,22717,"Decatur, IL Urbanized Area (2010)",93835,591
400C100US22744,22744,"Decatur, IN Urban Cluster (2010)",11182,382
400C100US22771,22771,"Decatur, TX Urban Cluster (2010)",5983,171
400C100US22798,22798,"Decorah, IA Urban Cluster (2010)",8143,238
400C100US22825,22825,"Deer Lodge, MT Urban Cluster (2010)",3229,77
400C100US22852,22852,"Deer Park, WA Urban Cluster (2010)",3398,175
400C100US22864,22864,"Deerwood, TX Urban Cluster (2010)",3650,795
400C100US22879,22879,"Defiance, OH Urban Cluster (2010)",17959,483
400C100US22933,22933,"De Funiak Springs, FL Urban Cluster (2010)",5640,579
400C100US22960,22960,"DeKalb, IL Urbanized Area (2010)",68814,589
400C100US22987,22987,"Delano, CA Urbanized Area (2010)",53700,448
400C100US22995,22995,"Delano, MN Urban Cluster (2010)",5125,159
400C100US23041,23041,"Delavan, WI Urban Cluster (2010)",12545,418
400C100US23095,23095,"Delhi, LA Urban Cluster (2010)",2802,113
400C100US23102,23102,"Delhi, NY Urban Cluster (2010)",2924,251
400C100US23122,23122,"Dell Rapids, SD Urban Cluster (2010)",3604,57
400C100US23149,23149,"Delphi, IN Urban Cluster (2010)",3259,311
400C100US23176,23176,"Delphos, OH Urban Cluster (2010)",7534,230
400C100US23203,23203,"Del Rio, TX Urban Cluster (2010)",43707,921
400C100US23230,23230,"Delta, CO Urban Cluster (2010)",7433,265
400C100US23257,23257,"Delta, OH Urban Cluster (2010)",3212,263
400C100US23284,23284,"Delta, UT Urban Cluster (2010)",3107,183
400C100US23311,23311,"Deltona, FL Urbanized Area (2010)",184166,1952
400C100US23338,23338,"Deming, NM Urban Cluster (2010)",14605,443
400C100US23365,23365,"Demopolis, AL Urban Cluster (2010)",6615,250
400C100US23392,23392,"De Motte, IN Urban Cluster (2010)",4598,335
400C100US23419,23419,"Denison, IA Urban Cluster (2010)",8112,105
400C100US23446,23446,"Denmark, SC Urban Cluster (2010)",3713,236
400C100US23473,23473,"Denton, MD Urban Cluster (2010)",4543,131
400C100US23500,23500,"Denton--Lewisville, TX Urbanized Area (2010)",369461,2008
400C100US23513,23513,"Denton Southwest, TX Urban Cluster (2010)",3121,387
400C100US23527,23527,"Denver--Aurora, CO Urbanized Area (2010)",2387236,2201
400C100US23554,23554,"Denver City, TX Urban Cluster (2010)",4972,201
400C100US23608,23608,"De Queen, AR Urban Cluster (2010)",6148,183
400C100US23635,23635,"DeQuincy, LA Urban Cluster (2010)",5402,348
400C100US23662,23662,"DeRidder, LA Urban Cluster (2010)",13353,381
400C100US23689,23689,"Dermott, AR Urban Cluster (2010)",2091,283
400C100US23716,23716,"Desert Hot Springs, CA Urban Cluster (2010)",38311,1332
400C100US23743,23743,"Des Moines, IA Urbanized Area (2010)",450297,1019
400C100US23770,23770,"De Soto, KS Urban Cluster (2010)",4857,267
400C100US23797,23797,"De Soto, MO Urban Cluster (2010)",7615,394
400C100US23824,23824,"Detroit, MI Urbanized Area (2010)",3740565,2000
400C100US23851,23851,"Detroit Lakes, MN Urban Cluster (2010)",8228,239
400C100US23878,23878,"Devils Lake, ND Urban Cluster (2010)",7373,123
400C100US23905,23905,"Devine, TX Urban Cluster (2010)",6086,423
400C100US23959,23959,"DeWitt, AR Urban Cluster (2010)",3214,63
400C100US23986,23986,"De Witt, IA Urban Cluster (2010)",4519,251
400C100US24013,24013,"Dexter, MO Urban Cluster (2010)",8635,292
400C100US24040,24040,"Diamondhead, MS Urban Cluster (2010)",8317,528
400C100US24067,24067,"Diboll, TX Urban Cluster (2010)",4773,412
400C100US24094,24094,"Dickinson, ND Urban Cluster (2010)",17858,208
400C100US24121,24121,"Dickson, TN Urban Cluster (2010)",16049,441
400C100US24148,24148,"Dilley, TX Urban Cluster (2010)",3915,135
400C100US24175,24175,"Dillon, MT Urban Cluster (2010)",4717,148
400C100US24202,24202,"Dillon, SC Urban Cluster (2010)",9280,762
400C100US24229,24229,"Dimmitt, TX Urban Cluster (2010)",4348,17
400C100US24256,24256,"Discovery Bay, CA Urban Cluster (2010)",13010,1114
400C100US24283,24283,"Dixon, CA Urban Cluster (2010)",18292,66
400C100US24310,24310,"Dixon, IL Urban Cluster (2010)",16416,319
400C100US24329,24329,"Dodge Center, MN Urban Cluster (2010)",2616,26
400C100US24337,24337,"Dodge City, KS Urban Cluster (2010)",27063,322
400C100US24364,24364,"Dodgeville, WI Urban Cluster (2010)",4657,93
400C100US24391,24391,"Donaldsonville, LA Urban Cluster (2010)",14280,717
400C100US24418,24418,"Donalsonville, GA Urban Cluster (2010)",2923,283
400C100US24433,24433,"Dorr, MI Urban Cluster (2010)",5256,512
400C100US24445,24445,"Dos Palos, CA Urban Cluster (2010)",7169,644
400C100US24472,24472,"Dothan, AL Urbanized Area (2010)",68449,611
400C100US24499,24499,"Douglas, AZ Urban Cluster (2010)",16307,868
400C100US24526,24526,"Douglas, GA Urban Cluster (2010)",14476,596
400C100US24539,24539,"Douglas, MI Urban Cluster (2010)",2356,269
400C100US24553,24553,"Douglas, WY Urban Cluster (2010)",6229,213
400C100US24580,24580,"Dover, DE Urbanized Area (2010)",110995,1365
400C100US24607,24607,"Dover--Rochester, NH--ME Urbanized Area (2010)",88720,1105
400C100US24634,24634,"Dowagiac, MI Urban Cluster (2010)",6013,296
400C100US24646,24646,"Downs, IL Urban Cluster (2010)",2349,331
400C100US24688,24688,"Dryden, NY Urban Cluster (2010)",3078,318
400C100US24715,24715,"Dublin, GA Urban Cluster (2010)",20490,718
400C100US24769,24769,"Dublin, TX Urban Cluster (2010)",3654,41
400C100US24796,24796,"DuBois, PA Urban Cluster (2010)",12109,379
400C100US24823,24823,"Dubuque, IA--IL Urbanized Area (2010)",67912,438
400C100US24850,24850,"Duluth, MN--WI Urbanized Area (2010)",119702,711
400C100US24877,24877,"Dumas, AR Urban Cluster (2010)",4926,114
400C100US24904,24904,"Dumas, TX Urban Cluster (2010)",14849,115
400C100US24931,24931,"Duncan, OK Urban Cluster (2010)",20960,534
400C100US24958,24958,"Dundee, MI Urban Cluster (2010)",3880,166
400C100US24985,24985,"Dunkirk, IN Urban Cluster (2010)",3663,214
400C100US25012,25012,"Dunkirk--Fredonia, NY Urban Cluster (2010)",25365,324
400C100US25025,25025,"Dunlap, TN Urban Cluster (2010)",4248,513
400C100US25039,25039,"Dunn, NC Urban Cluster (2010)",14759,321
400C100US25093,25093,"Du Quoin, IL Urban Cluster (2010)",6299,284
400C100US25120,25120,"Durand, MI Urban Cluster (2010)",5084,348
400C100US25147,25147,"Durango, CO Urban Cluster (2010)",18860,516
400C100US25174,25174,"Durant, MS Urban Cluster (2010)",2510,115
400C100US25201,25201,"Durant, OK Urban Cluster (2010)",16135,674
400C100US25228,25228,"Durham, NC Urbanized Area (2010)",349155,1725
400C100US25255,25255,"Dwight, IL Urban Cluster (2010)",5845,409
400C100US25282,25282,"Dyer, TN Urban Cluster (2010)",3344,333
400C100US25309,25309,"Dyersburg, TN Urban Cluster (2010)",21431,548
400C100US25336,25336,"Dyersville, IA Urban Cluster (2010)",3596,133
400C100US25363,25363,"Eagar, AZ Urban Cluster (2010)",6295,532
400C100US25390,25390,"Eagle, CO Urban Cluster (2010)",5604,378
400C100US25417,25417,"Eagle Grove, IA Urban Cluster (2010)",2949,230
400C100US25444,25444,"Eagle Lake, TX Urban Cluster (2010)",3612,30
400C100US25480,25480,"Eagle Mountain South, UT Urban Cluster (2010)",6353,550
400C100US25498,25498,"Eagle Pass, TX Urban Cluster (2010)",49171,859
400C100US25579,25579,"Earlimart, CA Urban Cluster (2010)",12106,915
400C100US25598,25598,"East Aurora, NY Urban Cluster (2010)",10180,444
400C100US25660,25660,"Eastland, TX Urban Cluster (2010)",3726,135
400C100US25687,25687,"East Liverpool, OH--WV--PA Urban Cluster (2010)",30837,691
400C100US25714,25714,"Eastman, GA Urban Cluster (2010)",6128,491
400C100US25741,25741,"Easton, MD Urban Cluster (2010)",16871,351
400C100US25768,25768,"East Palestine, OH Urban Cluster (2010)",5116,192
400C100US25795,25795,"East Prairie, MO Urban Cluster (2010)",3710,255
400C100US25802,25802,"East Prospect, PA Urban Cluster (2010)",2471,406
400C100US25813,25813,"East Quincy, CA Urban Cluster (2010)",2704,449
400C100US25849,25849,"East Stroudsburg, PA--NJ Urbanized Area (2010)",54078,1294
400C100US25876,25876,"East Tawas, MI Urban Cluster (2010)",4403,267
400C100US25903,25903,"East Troy, WI Urban Cluster (2010)",4014,157
400C100US25930,25930,"Eaton, CO Urban Cluster (2010)",4214,202
400C100US25957,25957,"Eaton, OH Urban Cluster (2010)",8197,97
400C100US25984,25984,"Eaton Rapids, MI Urban Cluster (2010)",5352,143
400C100US26011,26011,"Eatonton, GA Urban Cluster (2010)",4681,451
400C100US26024,26024,"Eatonville, WA Urban Cluster (2010)",2698,44
400C100US26038,26038,"Eau Claire, WI Urbanized Area (2010)",103029,688
400C100US26065,26065,"Ebensburg, PA Urban Cluster (2010)",5208,347
400C100US26092,26092,"Eden, NC Urban Cluster (2010)",17131,415
400C100US26119,26119,"Edenton, NC Urban Cluster (2010)",4944,79
400C100US26146,26146,"Edgefield, SC Urban Cluster (2010)",4237,262
400C100US26173,26173,"Edgerton, WI Urban Cluster (2010)",6734,305
400C100US26200,26200,"Edgewood, NM Urban Cluster (2010)",3006,567
400C100US26227,26227,"Edinboro, PA Urban Cluster (2010)",7357,229
400C100US26254,26254,"Edna, TX Urban Cluster (2010)",5267,171
400C100US26275,26275,"Edwards, CO Urban Cluster (2010)",17067,872
400C100US26308,26308,"Effingham, IL Urban Cluster (2010)",13836,467
400C100US26345,26345,"Eielson AFB, AK Urban Cluster (2010)",2501,453
400C100US26362,26362,"Elberton, GA Urban Cluster (2010)",6074,527
400C100US26389,26389,"El Campo, TX Urban Cluster (2010)",11478,282
400C100US26416,26416,"El Centro--Calexico, CA Urbanized Area (2010)",106627,880
400C100US26443,26443,"Eldon, MO Urban Cluster (2010)",4420,201
400C100US26470,26470,"El Dorado, AR Urban Cluster (2010)",18580,428
400C100US26497,26497,"Eldorado, IL Urban Cluster (2010)",4600,192
400C100US26524,26524,"El Dorado, KS Urban Cluster (2010)",14400,292
400C100US26551,26551,"Eldorado at Santa Fe, NM Urban Cluster (2010)",4221,512
400C100US26578,26578,"El Dorado Springs, MO Urban Cluster (2010)",3171,257
400C100US26632,26632,"Electra, TX Urban Cluster (2010)",2791,16
400C100US26659,26659,"Elgin, TX Urban Cluster (2010)",9792,808
400C100US26686,26686,"Elizabeth City, NC Urban Cluster (2010)",24285,768
400C100US26713,26713,"Elizabethtown, NC Urban Cluster (2010)",3187,196
400C100US26750,26750,"Elizabethtown--Radcliff, KY Urbanized Area (2010)",74172,1153
400C100US26767,26767,"Elk City, OK Urban Cluster (2010)",11290,510
400C100US26794,26794,"Elkhart, IN--MI Urbanized Area (2010)",143204,997
400C100US26821,26821,"Elkhorn, WI Urban Cluster (2010)",12240,355
400C100US26848,26848,"Elkin, NC Urban Cluster (2010)",6967,597
400C100US26875,26875,"Elkins, WV Urban Cluster (2010)",10889,489
400C100US26902,26902,"Elko, NV Urban Cluster (2010)",18849,388
400C100US26912,26912,"Elko New Market, MN Urban Cluster (2010)",3706,326
400C100US26956,26956,"Elkton, VA Urban Cluster (2010)",3507,359
400C100US26983,26983,"Ellensburg, WA Urban Cluster (2010)",20638,527
400C100US27010,27010,"Ellenville, NY Urban Cluster (2010)",6595,286
400C100US27037,27037,"Ellijay, GA Urban Cluster (2010)",3845,575
400C100US27064,27064,"Ellsworth, KS Urban Cluster (2010)",2716,388
400C100US27070,27070,"Ellsworth, ME Urban Cluster (2010)",2658,414
400C100US27076,27076,"Ellsworth, WI Urban Cluster (2010)",2744,135
400C100US27085,27085,"Ellwood City, PA Urban Cluster (2010)",13093,376
400C100US27118,27118,"Elmira, NY Urbanized Area (2010)",68320,839
400C100US27172,27172,"Elmwood, IL Urban Cluster (2010)",3132,176
400C100US27199,27199,"Eloy, AZ Urban Cluster (2010)",8153,902
400C100US27226,27226,"El Paso, IL Urban Cluster (2010)",2528,195
400C100US27253,27253,"El Paso, TX--NM Urbanized Area (2010)",799486,2256
400C100US27261,27261,"El Paso de Robles (Paso Robles)--Atascadero, CA Urbanized Area (2010)",64306,1078
400C100US27280,27280,"El Reno, OK Urban Cluster (2010)",14898,330
400C100US27290,27290,"Elroy, TX Urban Cluster (2010)",2952,731
400C100US27300,27300,"Elverson, PA Urban Cluster (2010)",3390,243
400C100US27307,27307,"Elwood, IN Urban Cluster (2010)",9223,202
400C100US27334,27334,"Ely, MN Urban Cluster (2010)",3471,13
400C100US27361,27361,"Ely, NV Urban Cluster (2010)",4749,209
400C100US27380,27380,"Emerald Bay, TX Urban Cluster (2010)",3755,402
400C100US27442,27442,"Emmetsburg, IA Urban Cluster (2010)",3487,165
400C100US27469,27469,"Emmett, ID Urban Cluster (2010)",8760,340
400C100US27496,27496,"Emmitsburg, MD--PA Urban Cluster (2010)",6706,419
400C100US27523,27523,"Emporia, KS Urban Cluster (2010)",25242,96
400C100US27550,27550,"Emporia, VA Urban Cluster (2010)",6687,362
400C100US27577,27577,"Emporium, PA Urban Cluster (2010)",2744,136
400C100US27592,27592,"Enfield, NC Urban Cluster (2010)",2585,430
400C100US27604,27604,"England, AR Urban Cluster (2010)",2807,34
400C100US27631,27631,"Enid, OK Urban Cluster (2010)",47662,410
400C100US27658,27658,"Ennis, TX Urban Cluster (2010)",17772,438
400C100US27685,27685,"Enterprise, AL Urban Cluster (2010)",36318,861
400C100US27712,27712,"Ephraim, UT Urban Cluster (2010)",5673,217
400C100US27739,27739,"Ephrata, WA Urban Cluster (2010)",7138,228
400C100US27750,27750,"Epping, NH Urban Cluster (2010)",3485,377
400C100US27766,27766,"Erie, PA Urbanized Area (2010)",196894,637
400C100US27793,27793,"Erwin, TN Urban Cluster (2010)",9989,466
400C100US27820,27820,"Escalon, CA Urban Cluster (2010)",7212,57
400C100US27847,27847,"Escanaba, MI Urban Cluster (2010)",20496,374
400C100US27874,27874,"Espanola, NM Urban Cluster (2010)",26166,1255
400C100US27885,27885,"Esparto, CA Urban Cluster (2010)",2892,487
400C100US27901,27901,"Estacada, OR Urban Cluster (2010)",3439,465
400C100US27928,27928,"Estes Park, CO Urban Cluster (2010)",7140,398
400C100US27955,27955,"Estherville, IA Urban Cluster (2010)",6137,105
400C100US27991,27991,"Estrella, AZ Urban Cluster (2010)",10621,998
400C100US28009,28009,"Etowah, TN Urban Cluster (2010)",4545,434
400C100US28063,28063,"Eudora, KS Urban Cluster (2010)",6406,210
400C100US28090,28090,"Eufaula, AL--GA Urban Cluster (2010)",9695,449
400C100US28117,28117,"Eugene, OR Urbanized Area (2010)",249698,1027
400C100US28144,28144,"Eunice, LA Urban Cluster (2010)",11941,487
400C100US28171,28171,"Eunice, NM Urban Cluster (2010)",2818,97
400C100US28198,28198,"Eureka, CA Urban Cluster (2010)",45360,966
400C100US28225,28225,"Eureka, IL Urban Cluster (2010)",5613,367
400C100US28252,28252,"Eureka, KS Urban Cluster (2010)",2579,44
400C100US28262,28262,"Eureka, MO Urban Cluster (2010)",9651,517
400C100US28306,28306,"Evanston, WY Urban Cluster (2010)",11761,352
400C100US28333,28333,"Evansville, IN--KY Urbanized Area (2010)",228584,1021
400C100US28360,28360,"Evansville, WI Urban Cluster (2010)",5832,168
400C100US28387,28387,"Evarts, KY Urban Cluster (2010)",2442,456
400C100US28414,28414,"Everett, PA Urban Cluster (2010)",3343,334
400C100US28431,28431,"Evergreen, AL Urban Cluster (2010)",2632,370
400C100US28441,28441,"Evergreen, CO Urban Cluster (2010)",13017,639
400C100US28468,28468,"Everson, WA Urban Cluster (2010)",4373,352
400C100US28495,28495,"Excelsior Springs, MO Urban Cluster (2010)",11148,325
400C100US28522,28522,"Fabens, TX Urban Cluster (2010)",8256,964
400C100US28549,28549,"Fairbanks, AK Urbanized Area (2010)",65614,1425
400C100US28576,28576,"Fairbury, IL Urban Cluster (2010)",3688,235
400C100US28603,28603,"Fairbury, NE Urban Cluster (2010)",4009,106
400C100US28624,28624,"Fairdale, PA Urban Cluster (2010)",3580,525
400C100US28657,28657,"Fairfield, CA Urbanized Area (2010)",133389,430
400C100US28684,28684,"Fairfield, IL Urban Cluster (2010)",5291,344
400C100US28711,28711,"Fairfield, IA Urban Cluster (2010)",9270,141
400C100US28738,28738,"Fairfield, TX Urban Cluster (2010)",3373,264
400C100US28765,28765,"Fairfield Glade, TN Urban Cluster (2010)",5766,480
400C100US28782,28782,"Fairfield Harbour, NC Urban Cluster (2010)",2613,281
400C100US28819,28819,"Fair Haven, VT Urban Cluster (2010)",4069,292
400C100US28846,28846,"Fairmont, MN Urban Cluster (2010)",9539,280
400C100US28860,28860,"Fairmont, NC Urban Cluster (2010)",2545,61
400C100US28873,28873,"Fairmont, WV Urban Cluster (2010)",33847,797
400C100US28900,28900,"Fairmount, IN Urban Cluster (2010)",2864,315
400C100US28954,28954,"Fairview, TN Urban Cluster (2010)",6160,374
400C100US29008,29008,"Falfurrias, TX Urban Cluster (2010)",4468,439
400C100US29035,29035,"Fallon, NV Urban Cluster (2010)",16704,657
400C100US29062,29062,"Falls City, NE Urban Cluster (2010)",4092,130
400C100US29089,29089,"Fargo, ND--MN Urbanized Area (2010)",176609,745
400C100US29116,29116,"Faribault, MN Urban Cluster (2010)",23743,253
400C100US29143,29143,"Farmersville, TX Urban Cluster (2010)",3168,161
400C100US29170,29170,"Farmerville, LA Urban Cluster (2010)",3788,180
400C100US29224,29224,"Farmington, ME Urban Cluster (2010)",3665,495
400C100US29251,29251,"Farmington, MO Urban Cluster (2010)",39706,589
400C100US29265,29265,"Farmington, NH Urban Cluster (2010)",2881,487
400C100US29278,29278,"Farmington, NM Urbanized Area (2010)",53699,1468
400C100US29305,29305,"Farmville, NC Urban Cluster (2010)",4644,240
400C100US29332,29332,"Farmville, VA Urban Cluster (2010)",8076,379
400C100US29359,29359,"Fayette, AL Urban Cluster (2010)",3537,272
400C100US29413,29413,"Fayette, MO Urban Cluster (2010)",2643,44
400C100US29440,29440,"Fayetteville, NC Urbanized Area (2010)",309624,2044
400C100US29467,29467,"Fayetteville, TN Urban Cluster (2010)",9056,509
400C100US29494,29494,"Fayetteville--Springdale--Rogers, AR--MO Urbanized Area (2010)",295888,1544
400C100US29510,29510,"Fearrington Village, NC Urban Cluster (2010)",2871,349
400C100US29521,29521,"Federalsburg, MD Urban Cluster (2010)",3143,143
400C100US29548,29548,"Fellsmere, FL Urban Cluster (2010)",4788,502
400C100US29575,29575,"Fergus Falls, MN Urban Cluster (2010)",11954,319
400C100US29602,29602,"Fernandina Beach, FL Urban Cluster (2010)",25492,1082
400C100US29656,29656,"Fernley, NV Urban Cluster (2010)",18828,337
400C100US29683,29683,"Ferriday, LA Urban Cluster (2010)",5279,447
400C100US29698,29698,"Filer, ID Urban Cluster (2010)",2556,65
400C100US29710,29710,"Fillmore, CA Urban Cluster (2010)",15021,102
400C100US29737,29737,"Findlay, OH Urban Cluster (2010)",48270,522
400C100US29764,29764,"Firebaugh, CA Urban Cluster (2010)",7177,355
400C100US29775,29775,"Firestone--Frederick, CO Urban Cluster (2010)",20968,546
400C100US29791,29791,"Fitzgerald, GA Urban Cluster (2010)",11701,487
400C100US29818,29818,"Flagstaff, AZ Urbanized Area (2010)",72248,1156
400C100US29845,29845,"Flemingsburg, KY Urban Cluster (2010)",2777,57
400C100US29872,29872,"Flint, MI Urbanized Area (2010)",356360,1374
400C100US29899,29899,"Flora, IL Urban Cluster (2010)",4945,254
400C100US29953,29953,"Florence, AL Urbanized Area (2010)",77798,1027
400C100US29980,29980,"Florence, AZ Urban Cluster (2010)",16847,930
400C100US30007,30007,"Florence, CO Urban Cluster (2010)",4098,148
400C100US30034,30034,"Florence, OR Urban Cluster (2010)",9862,302
400C100US30061,30061,"Florence, SC Urbanized Area (2010)",91980,1625
400C100US30088,30088,"Floresville, TX Urban Cluster (2010)",5851,345
400C100US30142,30142,"Floydada, TX Urban Cluster (2010)",2991,51
400C100US30171,30171,"Foley, AL Urban Cluster (2010)",24620,1249
400C100US30196,30196,"Folkston, GA Urban Cluster (2010)",5958,634
400C100US30223,30223,"Fond du Lac, WI Urbanized Area (2010)",54473,467
400C100US30250,30250,"Fordyce, AR Urban Cluster (2010)",3845,274
400C100US30277,30277,"Forest, MS Urban Cluster (2010)",4691,370
400C100US30304,30304,"Forest City, IA Urban Cluster (2010)",3904,111
400C100US30331,30331,"Forest City, NC Urban Cluster (2010)",26496,1035
400C100US30358,30358,"Forest Lake, MN Urban Cluster (2010)",21812,575
400C100US30385,30385,"Forestville, CA Urban Cluster (2010)",5050,593
400C100US30412,30412,"Forks, WA Urban Cluster (2010)",3863,193
400C100US30439,30439,"Forney, TX Urban Cluster (2010)",26279,956
400C100US30466,30466,"Forrest City, AR Urban Cluster (2010)",11748,745
400C100US30493,30493,"Forsyth, GA Urban Cluster (2010)",5063,518
400C100US30520,30520,"Forsyth, MO Urban Cluster (2010)",5927,573
400C100US30547,30547,"Fort Atkinson, WI Urban Cluster (2010)",20901,304
400C100US30574,30574,"Fort Bragg, CA Urban Cluster (2010)",9562,382
400C100US30601,30601,"Fort Branch, IN Urban Cluster (2010)",5105,387
400C100US30628,30628,"Fort Collins, CO Urbanized Area (2010)",265084,1409
400C100US30655,30655,"Fort Defiance, AZ--NM Urban Cluster (2010)",3918,863
400C100US30682,30682,"Fort Dodge, IA Urban Cluster (2010)",25049,290
400C100US30736,30736,"Fort Irwin, CA Urban Cluster (2010)",9581,864
400C100US30748,30748,"Fort Leonard Wood, MO Urban Cluster (2010)",29275,938
400C100US30755,30755,"Fort Lupton, CO Urban Cluster (2010)",9097,321
400C100US30763,30763,"Fort Madison, IA--IL Urban Cluster (2010)",10805,150
400C100US30790,30790,"Fort Meade, FL Urban Cluster (2010)",6250,458
400C100US30817,30817,"Fort Morgan, CO Urban Cluster (2010)",13078,470
400C100US30844,30844,"Fort Payne, AL Urban Cluster (2010)",6770,755
400C100US30858,30858,"Fort Plain, NY Urban Cluster (2010)",5980,391
400C100US30871,30871,"Fort Polk, LA Urban Cluster (2010)",13881,729
400C100US30898,30898,"Fort Scott, KS Urban Cluster (2010)",7866,122
400C100US30925,30925,"Fort Smith, AR--OK Urbanized Area (2010)",123148,860
400C100US30952,30952,"Fort Stockton, TX Urban Cluster (2010)",9358,360
400C100US30979,30979,"Fortuna, CA Urban Cluster (2010)",13214,308
400C100US31033,31033,"Fort Valley, GA Urban Cluster (2010)",11929,1227
400C100US31060,31060,"Fort Walton Beach--Navarre--Wright, FL Urbanized Area (2010)",196139,2092
400C100US31087,31087,"Fort Wayne, IN Urbanized Area (2010)",313766,1162
400C100US31114,31114,"Fostoria, OH Urban Cluster (2010)",14260,447
400C100US31150,31150,"Four Corners, FL Urban Cluster (2010)",37105,1965
400C100US31158,31158,"Four Corners, MT Urban Cluster (2010)",2394,295
400C100US31168,31168,"Fowlerville, MI Urban Cluster (2010)",3955,260
400C100US31195,31195,"Frankenmuth, MI Urban Cluster (2010)",5077,106
400C100US31222,31222,"Frankfort, IN Urban Cluster (2010)",16612,269
400C100US31249,31249,"Frankfort, KY Urban Cluster (2010)",35571,773
400C100US31276,31276,"Franklin, KY Urban Cluster (2010)",9392,362
400C100US31303,31303,"Franklin, LA Urban Cluster (2010)",14075,630
400C100US31330,31330,"Franklin, NH Urban Cluster (2010)",10271,611
400C100US31384,31384,"Franklin, NC Urban Cluster (2010)",6899,516
400C100US31411,31411,"Franklin (Venango County), PA Urban Cluster (2010)",9312,343
400C100US31438,31438,"Franklin, VA Urban Cluster (2010)",8902,329
400C100US31450,31450,"Franklin--Highland Lake, NJ Urban Cluster (2010)",34744,791
